,pub_date,word_count,type_of_material,_id,abstract,lead_paragraph,snippet,headline.main,text,relevance_rank,keyword_counts,polarity,subjectivity,finbert-sentiment-score,finbert-bin
127,2021-01-22 09:09:54+00:00,1311,News,nyt://article/85ce853c-5017-54e6-b6fb-18f7add4917d,The big tech platforms are facing a challenge unlike any other as Australia moves to make them pay for news.,"SYDNEY, Australia — In a major escalation, Google threatened on Friday to make its search engine unavailable in Australia if the government approved legislation that would force tech companies to pay for journalism shared on their platforms.",The big tech platforms are facing a challenge unlike any other as Australia moves to make them pay for news.,An Australia With No Google? The Bitter Fight Behind a Drastic Threat,"The big tech platforms are facing a challenge unlike any other as Australia moves to make them pay for news. SYDNEY, Australia — In a major escalation, Google threatened on Friday to make its search engine unavailable in Australia if the government approved legislation that would force tech companies to pay for journalism shared on their platforms. The big tech platforms are facing a challenge unlike any other as Australia moves to make them pay for news. An Australia With No Google? The Bitter Fight Behind a Drastic Threat ",2,2,-0.0982142857142857,0.3785714285714285,-0.8568127155303955,-1
128,2020-04-20 13:40:54+00:00,822,News,nyt://article/85e7796f-15ed-5428-8d71-80431a1ca5c7,"The decision, announced after talks on a voluntary system stalled, is part of a global push to save local news organizations.","MELBOURNE, Australia — The Australian government said on Monday that Google and Facebook would have to pay media outlets for news content in the country, part of an emerging global effort to rescue local publishers by moving to compel tech giants to share their advertising revenue.","The decision, announced after talks on a voluntary system stalled, is part of a global push to save local news organizations.",Australia Moves to Force Google and Facebook to Compensate Media Outlets,"The decision, announced after talks on a voluntary system stalled, is part of a global push to save local news organizations. MELBOURNE, Australia — The Australian government said on Monday that Google and Facebook would have to pay media outlets for news content in the country, part of an emerging global effort to rescue local publishers by moving to compel tech giants to share their advertising revenue. The decision, announced after talks on a voluntary system stalled, is part of a global push to save local news organizations. Australia Moves to Force Google and Facebook to Compensate Media Outlets ",4,2,0.0,0.0,-0.6076997518539429,-1
129,2021-06-21 16:19:48+00:00,1644,News,nyt://article/86610a4d-a3e1-51dd-aa12-a5b8118ed3dd,"Despite record profits, a number of them are worried that the company is suffering from both its size and leadership from its C.E.O., Sundar Pichai.","OAKLAND, Calif. — The seeds of a company’s downfall, it is often said in the business world, are sown when everything is going great.","Despite record profits, a number of them are worried that the company is suffering from both its size and leadership from its C.E.O., Sundar Pichai.",Google Executives See Cracks in Their Company’s Success,"Despite record profits, a number of them are worried that the company is suffering from both its size and leadership from its C.E.O., Sundar Pichai. OAKLAND, Calif. — The seeds of a company’s downfall, it is often said in the business world, are sown when everything is going great. Despite record profits, a number of them are worried that the company is suffering from both its size and leadership from its C.E.O., Sundar Pichai. Google Executives See Cracks in Their Company’s Success ",4,1,0.55,0.375,-0.9548502564430236,-2
131,2020-07-13 07:00:09+00:00,1299,News,nyt://article/88956e5e-854c-50ba-ad60-7f79aaff908a,A document sent by the search giant to Australian regulators argues that the company doesn’t control enough of the digital ad industry to overcharge customers or block competitors.,WASHINGTON — Google has largely stayed quiet about its conversations with federal investigators as the Justice Department has looked into whether the company abused its dominance of the online advertising market.,A document sent by the search giant to Australian regulators argues that the company doesn’t control enough of the digital ad industry to overcharge customers or block competitors.,How May Google Fight an Antitrust Case? Look at This Little-Noticed Paper,A document sent by the search giant to Australian regulators argues that the company doesn’t control enough of the digital ad industry to overcharge customers or block competitors. WASHINGTON — Google has largely stayed quiet about its conversations with federal investigators as the Justice Department has looked into whether the company abused its dominance of the online advertising market. A document sent by the search giant to Australian regulators argues that the company doesn’t control enough of the digital ad industry to overcharge customers or block competitors. How May Google Fight an Antitrust Case? Look at This Little-Noticed Paper ,1,2,0.0214285714285714,0.3761904761904762,-0.6010151505470276,-1
132,2021-07-28 17:00:27+00:00,452,News,nyt://article/89158cd7-8da8-5331-a7ea-d6f80a9d5471,The tech giant joins other companies that have readjusted their plans as the more contagious Delta variant of the coronavirus sweeps through the country.,"Google said Wednesday that it would require employees who returned to the company’s offices to be vaccinated against the coronavirus. It also said it would push back its official return-to-office date to mid-October from September, joining a host of other companies whose plans have been scrambled in recent days by the spread of the highly contagious Delta variant.",The tech giant joins other companies that have readjusted their plans as the more contagious Delta variant of the coronavirus sweeps through the country.,Google mandates vaccines for employees and delays its return to the office to October.,"The tech giant joins other companies that have readjusted their plans as the more contagious Delta variant of the coronavirus sweeps through the country. Google said Wednesday that it would require employees who returned to the company’s offices to be vaccinated against the coronavirus. It also said it would push back its official return-to-office date to mid-October from September, joining a host of other companies whose plans have been scrambled in recent days by the spread of the highly contagious Delta variant. The tech giant joins other companies that have readjusted their plans as the more contagious Delta variant of the coronavirus sweeps through the country. Google mandates vaccines for employees and delays its return to the office to October. ",1,2,0.0785,0.4915,-0.8203986883163452,-1
133,2021-08-23 21:29:27+00:00,1445,News,nyt://article/89de7db8-1b36-57e9-9daa-dcdd6c6ee479,A proposal in the South Korean legislature is an early test of how forcefully the Biden administration will defend the companies abroad while trying to trim their power at home.,"WASHINGTON — For months, Apple and Google have been fighting a bill in the South Korean legislature that they say could imperil their lucrative app store businesses. The companies have appealed directly to South Korean lawmakers, government officials and the public to try to block the legislation, which is expected to face a crucial vote this week.",A proposal in the South Korean legislature is an early test of how forcefully the Biden administration will defend the companies abroad while trying to trim their power at home.,Apple and Google’s Fight in Seoul Tests Biden in Washington,"A proposal in the South Korean legislature is an early test of how forcefully the Biden administration will defend the companies abroad while trying to trim their power at home. WASHINGTON — For months, Apple and Google have been fighting a bill in the South Korean legislature that they say could imperil their lucrative app store businesses. The companies have appealed directly to South Korean lawmakers, government officials and the public to try to block the legislation, which is expected to face a crucial vote this week. A proposal in the South Korean legislature is an early test of how forcefully the Biden administration will defend the companies abroad while trying to trim their power at home. Apple and Google’s Fight in Seoul Tests Biden in Washington ",5,2,0.0333333333333333,0.411111111111111,-0.722119152545929,-1
137,2021-06-16 14:00:06+00:00,296,News,nyt://article/8d9c8eab-c8ba-55cb-a7a8-5d2f1ac35ae1,"The store, on the ground floor of the company’s Manhattan headquarters, will feature Google gadgets and branded gear, such as T-shirts, hats and dog toys.","Five years ago, Google started making its own smartphones and voice-assisted speakers. Now, Google has a store to sell them in.","The store, on the ground floor of the company’s Manhattan headquarters, will feature Google gadgets and branded gear, such as T-shirts, hats and dog toys.","Google is ready to open its first store, in New York.","The store, on the ground floor of the company’s Manhattan headquarters, will feature Google gadgets and branded gear, such as T-shirts, hats and dog toys. Five years ago, Google started making its own smartphones and voice-assisted speakers. Now, Google has a store to sell them in. The store, on the ground floor of the company’s Manhattan headquarters, will feature Google gadgets and branded gear, such as T-shirts, hats and dog toys. Google is ready to open its first store, in New York. ",2,5,0.1694805194805195,0.5411255411255411,0.0,0
139,2020-02-02 19:15:18+00:00,1414,News,nyt://article/9097dde9-0c30-5e18-9deb-68c4c64c01fb,Uplifting spots from major brands stayed away from divisive issues on TV’s biggest ad day. But Trump and Bloomberg crashed the party.,"An audience expected to be around 100 million. Big companies paying as much as $5.6 million for 30 seconds of advertising time. In addition to deciding the National Football League champion, the Super Bowl is the biggest event of the year for TV commercials.",Uplifting spots from major brands stayed away from divisive issues on TV’s biggest ad day. But Trump and Bloomberg crashed the party.,"2020 Super Bowl Commercials: Funeral for Mr. Peanut, Tears for Google","Uplifting spots from major brands stayed away from divisive issues on TV’s biggest ad day. But Trump and Bloomberg crashed the party. An audience expected to be around 100 million. Big companies paying as much as $5.6 million for 30 seconds of advertising time. In addition to deciding the National Football League champion, the Super Bowl is the biggest event of the year for TV commercials. Uplifting spots from major brands stayed away from divisive issues on TV’s biggest ad day. But Trump and Bloomberg crashed the party. 2020 Super Bowl Commercials: Funeral for Mr. Peanut, Tears for Google ",5,1,0.1273809523809523,0.4333333333333333,0.0,0
140,2021-07-07 22:28:03+00:00,867,News,nyt://article/910c4632-bda2-54fe-b2c9-526fc5b35a93,Software developers have accused the company of harsh policies and taking a large cut of financial transactions in their apps.,"WASHINGTON — A group of 36 states and the District of Columbia sued Google on Wednesday over claims that its mobile app store abuses its market power and forces aggressive terms on software developers, expanding the legal challenges facing the internet search giant.",Software developers have accused the company of harsh policies and taking a large cut of financial transactions in their apps.,Dozens of States Sue Google Over App Store Fees,"Software developers have accused the company of harsh policies and taking a large cut of financial transactions in their apps. WASHINGTON — A group of 36 states and the District of Columbia sued Google on Wednesday over claims that its mobile app store abuses its market power and forces aggressive terms on software developers, expanding the legal challenges facing the internet search giant. Software developers have accused the company of harsh policies and taking a large cut of financial transactions in their apps. Dozens of States Sue Google Over App Store Fees ",1,2,0.0285714285714285,0.4321428571428571,-0.9496446251869202,-2
141,2020-10-22 09:00:21+00:00,845,News,nyt://article/9225403b-6397-5ea0-b4a5-7f5f3112f3f7,"Jeffrey A. Rosen, the deputy attorney general, said the Justice Department knew the company would use its many resources to fight the agency.","Jeffrey A. Rosen, the deputy attorney general, wouldn’t normally oversee an antitrust investigation into Google. It would usually fall to the head of the Justice Department’s antitrust division. But that official, Makan Delrahim, recused himself because the company is a former legal client.","Jeffrey A. Rosen, the deputy attorney general, said the Justice Department knew the company would use its many resources to fight the agency.",Top Investigator in Google Case Says There ‘Was Not a Rush’ to Sue,"Jeffrey A. Rosen, the deputy attorney general, said the Justice Department knew the company would use its many resources to fight the agency. Jeffrey A. Rosen, the deputy attorney general, wouldn’t normally oversee an antitrust investigation into Google. It would usually fall to the head of the Justice Department’s antitrust division. But that official, Makan Delrahim, recused himself because the company is a former legal client. Jeffrey A. Rosen, the deputy attorney general, said the Justice Department knew the company would use its many resources to fight the agency. Top Investigator in Google Case Says There ‘Was Not a Rush’ to Sue ",3,2,0.175,0.41,0.0,0
142,2020-10-21 11:00:20+00:00,1130,News,nyt://article/93083864-518f-5b30-8043-9f695c108f8c,A sweeping antitrust lawsuit arrives: This is your morning tip sheet.,"The Justice Department takes on Google, but Trump wants it to look elsewhere, too: into Biden’s family. It’s Wednesday, and this is your politics tip sheet. Sign up here to get On Politics in your inbox every weekday.",A sweeping antitrust lawsuit arrives: This is your morning tip sheet.,The Justice Dept. vs. Google,"A sweeping antitrust lawsuit arrives: This is your morning tip sheet. The Justice Department takes on Google, but Trump wants it to look elsewhere, too: into Biden’s family. It’s Wednesday, and this is your politics tip sheet. Sign up here to get On Politics in your inbox every weekday. A sweeping antitrust lawsuit arrives: This is your morning tip sheet. The Justice Dept. vs. Google ",2,2,0.2,0.1,0.0,0
143,2020-10-20 22:23:21+00:00,1130,Op-Ed,nyt://article/935a5709-8195-5c86-b0ea-756c42e94f6f,The time to do anything substantive about the overwhelming power of the giant tech companies passed very long ago.,"It might seem a Silicon Valley cliché, but it was a garage — a pretty dumpy one for those who got to visit it just over two decades ago — that served as the birthplace of what the U.S. government today is calling a crippler of competition, a reducer of consumer choice and a stifler of innovation.",The time to do anything substantive about the overwhelming power of the giant tech companies passed very long ago.,"The Justice Dept.’s Lawsuit Against Google: Too Little, Too Late","The time to do anything substantive about the overwhelming power of the giant tech companies passed very long ago. It might seem a Silicon Valley cliché, but it was a garage — a pretty dumpy one for those who got to visit it just over two decades ago — that served as the birthplace of what the U.S. government today is calling a crippler of competition, a reducer of consumer choice and a stifler of innovation. The time to do anything substantive about the overwhelming power of the giant tech companies passed very long ago. The Justice Dept.’s Lawsuit Against Google: Too Little, Too Late ",2,1,0.0702777777777777,0.7933333333333332,0.0,0
144,2020-02-20 23:21:02+00:00,856,News,nyt://article/93bfcad9-9b67-5ba5-b56d-cd38cf02da75,"The lawsuit says that Google, the top tech brand in public schools, used its educational products to spy on students.","New Mexico’s attorney general sued Google on Thursday, saying the tech giant used its educational products to spy on the state’s children and families.","The lawsuit says that Google, the top tech brand in public schools, used its educational products to spy on students.",New Mexico Sues Google Over Children’s Privacy Violations,"The lawsuit says that Google, the top tech brand in public schools, used its educational products to spy on students. New Mexico’s attorney general sued Google on Thursday, saying the tech giant used its educational products to spy on the state’s children and families. The lawsuit says that Google, the top tech brand in public schools, used its educational products to spy on students. New Mexico Sues Google Over Children’s Privacy Violations ",4,4,0.1884297520661157,0.3902203856749311,-0.8140886425971985,-1
145,2020-03-10 15:44:21+00:00,1412,News,nyt://article/93d985f5-e72e-5ff8-b1e5-d7668f31b4fb,"Faced with an array of opponents for its sensor-laden city of tomorrow in Toronto, a Google sibling has drastically dialed back plans. The critics now want the tech giant to quit altogether.","TORONTO — The announcement was big enough for Prime Minister Justin Trudeau to fly down to Toronto and deliver. A corporate sibling of Google had been selected to transform a largely abandoned port area in Toronto into an innovative, sensor-laden, tech-centric city of tomorrow.","Faced with an array of opponents for its sensor-laden city of tomorrow in Toronto, a Google sibling has drastically dialed back plans. The critics now want the tech giant to quit altogether.",You Can’t Fight City Hall. But Maybe You Can Fight Google.,"Faced with an array of opponents for its sensor-laden city of tomorrow in Toronto, a Google sibling has drastically dialed back plans. The critics now want the tech giant to quit altogether. TORONTO — The announcement was big enough for Prime Minister Justin Trudeau to fly down to Toronto and deliver. A corporate sibling of Google had been selected to transform a largely abandoned port area in Toronto into an innovative, sensor-laden, tech-centric city of tomorrow. Faced with an array of opponents for its sensor-laden city of tomorrow in Toronto, a Google sibling has drastically dialed back plans. The critics now want the tech giant to quit altogether. You Can’t Fight City Hall. But Maybe You Can Fight Google. ",2,4,0.1235209235209235,0.4743145743145742,0.0,0
147,2021-01-29 04:03:39+00:00,1358,News,nyt://article/95934b43-86f0-54a0-8c13-ddeb2844c4fd,"After the tech giant threatened to take its search engine offline in Australia, I’ve been looking into some alternatives.",It’s the first port of call for any random question that pops into our heads. The repository of basically all knowledge on the internet. The search engine so ubiquitous it’s a verb.,"After the tech giant threatened to take its search engine offline in Australia, I’ve been looking into some alternatives.",My Attempt to Prepare for a Future Without Google,"After the tech giant threatened to take its search engine offline in Australia, I’ve been looking into some alternatives. It’s the first port of call for any random question that pops into our heads. The repository of basically all knowledge on the internet. The search engine so ubiquitous it’s a verb. After the tech giant threatened to take its search engine offline in Australia, I’ve been looking into some alternatives. My Attempt to Prepare for a Future Without Google ",2,1,-0.05,0.5916666666666666,0.0,0
148,2020-05-07 16:11:40+00:00,1070,News,nyt://article/95ef1b84-2bc3-5c36-a00a-d6ae1542918e,"In scrapping the project, the company cited the economic upheaval caused by the coronavirus pandemic, but critics say it was a loser from the start and a failure in “surveillance capitalism.”","OTTAWA — Citing the economic turmoil from the coronavirus pandemic, a corporate sibling of Google said on Thursday that it had abandoned ambitious plans to create a sensor-laden, data driven “city of tomorrow” out of a shabby district along Toronto’s Lake Ontario shoreline.","In scrapping the project, the company cited the economic upheaval caused by the coronavirus pandemic, but critics say it was a loser from the start and a failure in “surveillance capitalism.”",Google Sibling Abandons Ambitious City of the Future in Toronto,"In scrapping the project, the company cited the economic upheaval caused by the coronavirus pandemic, but critics say it was a loser from the start and a failure in “surveillance capitalism.” OTTAWA — Citing the economic turmoil from the coronavirus pandemic, a corporate sibling of Google said on Thursday that it had abandoned ambitious plans to create a sensor-laden, data driven “city of tomorrow” out of a shabby district along Toronto’s Lake Ontario shoreline. In scrapping the project, the company cited the economic upheaval caused by the coronavirus pandemic, but critics say it was a loser from the start and a failure in “surveillance capitalism.” Google Sibling Abandons Ambitious City of the Future in Toronto ",3,2,0.0518518518518518,0.3138888888888889,-0.9056073427200316,-2
149,2020-10-13 17:13:05+00:00,1369,News,nyt://article/975c9537-3241-5ba3-b368-3a4fce2ae23a,A company operating in the shadow of government regulators has some very particular rules about what workers can say about it.,"OAKLAND, Calif. — Google employees are not shy about speaking up. In the last few years, they have openly confronted the company about building a censored search engine in China, the handling of sexual harassment claims and its work with the Pentagon on artificial intelligence technology for weapons.",A company operating in the shadow of government regulators has some very particular rules about what workers can say about it.,Google Employees Are Free to Speak Up. Except on Antitrust.,"A company operating in the shadow of government regulators has some very particular rules about what workers can say about it. OAKLAND, Calif. — Google employees are not shy about speaking up. In the last few years, they have openly confronted the company about building a censored search engine in China, the handling of sexual harassment claims and its work with the Pentagon on artificial intelligence technology for weapons. A company operating in the shadow of government regulators has some very particular rules about what workers can say about it. Google Employees Are Free to Speak Up. Except on Antitrust. ",1,2,0.087037037037037,0.5185185185185186,0.0,0
150,2020-08-14 11:58:19+00:00,1827,News,nyt://article/9864c477-11bb-5055-bf5f-eba7b89f8969,"A gutsy gambit by the maker of Fortnite, which is locked in a fight with Apple and Google.",Want this delivered to your inbox each day? Sign up here.,"A gutsy gambit by the maker of Fortnite, which is locked in a fight with Apple and Google.",An Epic Battle,"A gutsy gambit by the maker of Fortnite, which is locked in a fight with Apple and Google. Want this delivered to your inbox each day? Sign up here. A gutsy gambit by the maker of Fortnite, which is locked in a fight with Apple and Google. An Epic Battle ",5,2,0.1,0.4,0.0,0
154,2020-08-03 15:00:09+00:00,1138,News,nyt://article/99701a1b-b73c-545e-9aa5-aa67cbdaf388,"Yes, you can now pay less than $399 for a smartphone — and it won’t stink.","People generally adore Google for bringing useful technology to the masses at an aggressively low price, if not free.","Yes, you can now pay less than $399 for a smartphone — and it won’t stink.","Google Pixel 4A Review: At $350, a Win for Those on a Budget","Yes, you can now pay less than $399 for a smartphone — and it won’t stink. People generally adore Google for bringing useful technology to the masses at an aggressively low price, if not free. Yes, you can now pay less than $399 for a smartphone — and it won’t stink. Google Pixel 4A Review: At $350, a Win for Those on a Budget ",5,2,0.0880952380952381,0.3047619047619047,0.0,0
