,pub_date,word_count,type_of_material,_id,abstract,lead_paragraph,snippet,headline.main,text,relevance_rank,keyword_counts,polarity,subjectivity,finbert-sentiment-score,finbert-bin
1,2021-08-31 17:07:21+00:00,191,News,nyt://article/026a2f96-48f3-5896-916e-badc358da577,It is the latest company to push back plans for a return in light of the spread of the highly contagious Delta variant of the coronavirus.,"Google is pushing back its return-to-office date by three months, to Jan. 10, in a decision that reflects the spread of the highly contagious Delta variant of the coronavirus.",It is the latest company to push back plans for a return in light of the spread of the highly contagious Delta variant of the coronavirus.,Google delays its return to office until January.,"It is the latest company to push back plans for a return in light of the spread of the highly contagious Delta variant of the coronavirus. Google is pushing back its return-to-office date by three months, to Jan. 10, in a decision that reflects the spread of the highly contagious Delta variant of the coronavirus. It is the latest company to push back plans for a return in light of the spread of the highly contagious Delta variant of the coronavirus. Google delays its return to office until January. ",4,2,0.228,0.482,-0.7278566360473633,-1
2,2021-04-12 16:50:18+00:00,607,Letter,nyt://article/02b7abdf-e925-5941-b577-9c2737ba4c97,"Readers discuss formative experiences in the workplace, at Google and elsewhere.",To the Editor:,"Readers discuss formative experiences in the workplace, at Google and elsewhere.",My Job and I: Is This a Love Letter?,"Readers discuss formative experiences in the workplace, at Google and elsewhere. To the Editor: Readers discuss formative experiences in the workplace, at Google and elsewhere. My Job and I: Is This a Love Letter? ",1,2,0.5,0.6,0.0,0
3,2020-10-21 11:56:39+00:00,2057,News,nyt://article/0322b0d5-4d0a-50bf-93f5-2fe37e9d95fd,What you need to know about the antitrust case against the tech giant.,"This Nov. 17 and 18, DealBook opens its doors to our first Online Summit. Join us as we welcome the most consequential newsmakers in business, policy and culture to explore the pivotal questions of the moment — and the future. Watch from anywhere in the world, free of charge. Register now.",What you need to know about the antitrust case against the tech giant.,What Did Google Do?,"What you need to know about the antitrust case against the tech giant. This Nov. 17 and 18, DealBook opens its doors to our first Online Summit. Join us as we welcome the most consequential newsmakers in business, policy and culture to explore the pivotal questions of the moment — and the future. Watch from anywhere in the world, free of charge. Register now. What you need to know about the antitrust case against the tech giant. What Did Google Do? ",2,1,0.3062499999999999,0.6822916666666666,0.0,0
4,2020-06-04 22:04:38+00:00,1268,News,nyt://article/044a14cb-41a2-54a5-aef6-273f5b338387,"To placate European regulators, the company started giving Android phone users a choice in search engines when they set up their devices.","OAKLAND, Calif. — For the last few months, some people who bought a new smartphone in Europe with Google’s Android software were presented with an extra option while setting up the device: choosing a search engine other than Google.","To placate European regulators, the company started giving Android phone users a choice in search engines when they set up their devices.",Google’s European Search Menu Draws Interest of U.S. Antitrust Investigators,"To placate European regulators, the company started giving Android phone users a choice in search engines when they set up their devices. OAKLAND, Calif. — For the last few months, some people who bought a new smartphone in Europe with Google’s Android software were presented with an extra option while setting up the device: choosing a search engine other than Google. To placate European regulators, the company started giving Android phone users a choice in search engines when they set up their devices. Google’s European Search Menu Draws Interest of U.S. Antitrust Investigators ",1,3,-0.0235795454545454,0.1370265151515151,0.0,0
6,2020-10-08 21:38:26+00:00,775,News,nyt://article/04d8f98c-5431-5cbd-a25a-9181dd9dab38,"The complaint says the contractor, HCL, refused to negotiate with the union and retaliated by shipping work to Poland.","A federal agency issued a complaint this week against a contractor hired by Google and accused it of violating its employees’ labor rights, marking the latest flash point in a long-running struggle between workers and technology companies.","The complaint says the contractor, HCL, refused to negotiate with the union and retaliated by shipping work to Poland.",Labor Board Accuses Google Contractor of Violating Union Rights,"The complaint says the contractor, HCL, refused to negotiate with the union and retaliated by shipping work to Poland. A federal agency issued a complaint this week against a contractor hired by Google and accused it of violating its employees’ labor rights, marking the latest flash point in a long-running struggle between workers and technology companies. The complaint says the contractor, HCL, refused to negotiate with the union and retaliated by shipping work to Poland. Labor Board Accuses Google Contractor of Violating Union Rights ",1,2,-0.0999999999999999,0.375,-0.9551718831062316,-2
7,2020-12-14 10:00:12+00:00,1409,News,nyt://article/062fd36b-55b7-52af-bd70-ba03930c9891,"As regulators seek ways to curb the company’s power, there is more focus on the vast index — hundreds of billions of web pages — behind its search engine.","OAKLAND, Calif. — In 2000, just two years after it was founded, Google reached a milestone that would lay the foundation for its dominance over the next 20 years: It became the world’s largest search engine, with an index of more than one billion web pages.","As regulators seek ways to curb the company’s power, there is more focus on the vast index — hundreds of billions of web pages — behind its search engine.",Google Dominates Thanks to an Unrivaled View of the Web,"As regulators seek ways to curb the company’s power, there is more focus on the vast index — hundreds of billions of web pages — behind its search engine. OAKLAND, Calif. — In 2000, just two years after it was founded, Google reached a milestone that would lay the foundation for its dominance over the next 20 years: It became the world’s largest search engine, with an index of more than one billion web pages. As regulators seek ways to curb the company’s power, there is more focus on the vast index — hundreds of billions of web pages — behind its search engine. Google Dominates Thanks to an Unrivaled View of the Web ",5,2,0.1,0.5666666666666668,0.0,0
9,2021-02-20 00:11:01+00:00,418,News,nyt://article/07164626-1262-5d2f-bae9-8b59bd4bcb56,"Two months after the jarring departure of a well-known artificial intelligence researcher at Google, a second A.I. researcher at the company said she was fired after criticizing the way it has treated employees who were working on ways to address bias and toxicity in its artificial intelligence systems.","Two months after the jarring departure of a well-known artificial intelligence researcher at Google, a second A.I. researcher at the company said she was fired after criticizing the way it has treated employees who were working on ways to address bias and toxicity in its artificial intelligence systems.",,A second Google A.I. researcher says the company fired her.,"Two months after the jarring departure of a well-known artificial intelligence researcher at Google, a second A.I. researcher at the company said she was fired after criticizing the way it has treated employees who were working on ways to address bias and toxicity in its artificial intelligence systems. Two months after the jarring departure of a well-known artificial intelligence researcher at Google, a second A.I. researcher at the company said she was fired after criticizing the way it has treated employees who were working on ways to address bias and toxicity in its artificial intelligence systems.  A second Google A.I. researcher says the company fired her. ",4,3,-0.3428571428571428,0.5714285714285714,-0.9567769765853882,-2
11,2020-10-22 09:00:11+00:00,936,Op-Ed,nyt://article/093473a5-d259-588e-a150-a0d9c4c2786f,The Justice Department is demanding that the company prove its greatness by competing in the market.,"The true significance of the federal antitrust lawsuit filed against Google on Tuesday cannot be captured by any narrow debate about legal doctrine or what the case will mean for the company. This is a big case, filed during an important time, and it merits a commensurately broad understanding. The complaint marks the return of the U.S. government to a role that many of us long feared it had abandoned: disciplining the country’s largest and most powerful monopolies.",The Justice Department is demanding that the company prove its greatness by competing in the market.,"Google, You Can’t Buy Your Way Out of This","The Justice Department is demanding that the company prove its greatness by competing in the market. The true significance of the federal antitrust lawsuit filed against Google on Tuesday cannot be captured by any narrow debate about legal doctrine or what the case will mean for the company. This is a big case, filed during an important time, and it merits a commensurately broad understanding. The complaint marks the return of the U.S. government to a role that many of us long feared it had abandoned: disciplining the country’s largest and most powerful monopolies. The Justice Department is demanding that the company prove its greatness by competing in the market. Google, You Can’t Buy Your Way Out of This ",2,2,0.1208333333333333,0.4958333333333334,0.0,0
15,2021-11-16 12:46:08+00:00,262,News,nyt://article/0d5c22c4-e8b2-57c3-ae3f-c4bcabfc1cbc,"After regulatory fights, the search giant pledged to expand its hiring in the country.","Google announced on Tuesday that it would invest $740 million in Australia over the next five years, promising to build a research hub, increase its cloud computing capacity and team up with government scientists to address challenges like expanding the use of green energy.","After regulatory fights, the search giant pledged to expand its hiring in the country.","Google will invest $740 million in Australia, including a research hub.","After regulatory fights, the search giant pledged to expand its hiring in the country. Google announced on Tuesday that it would invest $740 million in Australia over the next five years, promising to build a research hub, increase its cloud computing capacity and team up with government scientists to address challenges like expanding the use of green energy. After regulatory fights, the search giant pledged to expand its hiring in the country. Google will invest $740 million in Australia, including a research hub. ",4,2,0.0,0.5599999999999999,0.8923125267028809,1
16,2021-10-26 20:36:19+00:00,483,News,nyt://article/0f2c9baa-b0ac-5843-a76e-26735e5da660,The results easily topped analysts’ forecasts.,"Google’s parent company, Alphabet, shrugged off any concerns about a downturn in online advertising with another quarter of blockbuster earnings, lifted by continued strong demand for ads on YouTube and steady growth at its cloud computing business.",The results easily topped analysts’ forecasts.,Google’s profit and revenue soared in the third quarter.,"The results easily topped analysts’ forecasts. Google’s parent company, Alphabet, shrugged off any concerns about a downturn in online advertising with another quarter of blockbuster earnings, lifted by continued strong demand for ads on YouTube and steady growth at its cloud computing business. The results easily topped analysts’ forecasts. Google’s profit and revenue soared in the third quarter. ",5,2,0.2933333333333333,0.58,0.9522884488105774,2
17,2020-10-07 21:02:41+00:00,754,News,nyt://article/0fec5a12-f178-53d6-807f-c99831885ba3,"In a case with major implications, the justices wrestled with a high-tech dispute over computer code using low-tech analogies.","WASHINGTON — The Supreme Court considered on Wednesday whether Google should have to pay Oracle billions of dollars in a long-running lawsuit over software used on many of the world’s smartphones, wrestling during a lively argument with the potentially enormous implications of what has been called the copyright case of the decade.","In a case with major implications, the justices wrestled with a high-tech dispute over computer code using low-tech analogies.",Supreme Court Hears Copyright Battle Between Google and Oracle,"In a case with major implications, the justices wrestled with a high-tech dispute over computer code using low-tech analogies. WASHINGTON — The Supreme Court considered on Wednesday whether Google should have to pay Oracle billions of dollars in a long-running lawsuit over software used on many of the world’s smartphones, wrestling during a lively argument with the potentially enormous implications of what has been called the copyright case of the decade. In a case with major implications, the justices wrestled with a high-tech dispute over computer code using low-tech analogies. Supreme Court Hears Copyright Battle Between Google and Oracle ",2,2,0.1522727272727272,0.58,-0.8492746949195862,-1
19,2021-03-25 22:37:48+00:00,1483,News,nyt://article/1039b473-e21b-598d-a0d2-a2683745725f,Tech executives testified before a House committee on Thursday. We spoke to a legal expert about the likelihood of real change.,"The leaders of Google, Facebook and Twitter testified on Thursday before a House committee in their first appearances on Capitol Hill since the start of the Biden administration. As expected, sparks flew.",Tech executives testified before a House committee on Thursday. We spoke to a legal expert about the likelihood of real change.,Is a Big Tech Overhaul Just Around the Corner?,"Tech executives testified before a House committee on Thursday. We spoke to a legal expert about the likelihood of real change. The leaders of Google, Facebook and Twitter testified on Thursday before a House committee in their first appearances on Capitol Hill since the start of the Biden administration. As expected, sparks flew. Tech executives testified before a House committee on Thursday. We spoke to a legal expert about the likelihood of real change. Is a Big Tech Overhaul Just Around the Corner? ",5,1,0.1357142857142857,0.2619047619047619,0.0,0
20,2021-06-04 10:29:12+00:00,633,News,nyt://article/1120e9b3-6215-5840-a623-e554aa06e52f,"A Google fact box singled out Kannada, a language spoken in the country’s south. The faux pas highlights the algorithm’s fallibility.","It was an odd, unanswerable question. Still, it was on the mind of at least one Google user in India.","A Google fact box singled out Kannada, a language spoken in the country’s south. The faux pas highlights the algorithm’s fallibility.",India’s ‘Ugliest’ Language? Google Had an Answer (and Drew a Backlash).,"A Google fact box singled out Kannada, a language spoken in the country’s south. The faux pas highlights the algorithm’s fallibility. It was an odd, unanswerable question. Still, it was on the mind of at least one Google user in India. A Google fact box singled out Kannada, a language spoken in the country’s south. The faux pas highlights the algorithm’s fallibility. India’s ‘Ugliest’ Language? Google Had an Answer (and Drew a Backlash). ",1,4,-0.2333333333333333,0.325,-0.4828122556209564,0
21,2020-03-03 02:01:49+00:00,403,News,nyt://article/11a49bc1-e07c-5e93-9d25-3cd3a9620df0,"Alphabet’s self-driving unit, a pioneer in autonomous vehicle research, has been expanding its commercial efforts.","SAN FRANCISCO — More than a decade after Google started experimenting with driverless cars, Waymo, the autonomous vehicle unit of Google’s parent company, Alphabet, says it has raised $2.25 billion, mostly from outside investors.","Alphabet’s self-driving unit, a pioneer in autonomous vehicle research, has been expanding its commercial efforts.",Waymo Includes Outsiders in $2.25 Billion Investment Round,"Alphabet’s self-driving unit, a pioneer in autonomous vehicle research, has been expanding its commercial efforts. SAN FRANCISCO — More than a decade after Google started experimenting with driverless cars, Waymo, the autonomous vehicle unit of Google’s parent company, Alphabet, says it has raised $2.25 billion, mostly from outside investors. Alphabet’s self-driving unit, a pioneer in autonomous vehicle research, has been expanding its commercial efforts. Waymo Includes Outsiders in $2.25 Billion Investment Round ",3,2,0.2222222222222222,0.3944444444444444,0.5638223886489868,1
25,2020-10-30 16:13:41+00:00,1161,News,nyt://article/12915540-88da-5a0a-9b30-4593a059370c,These companies have mastered spending big to stay Big Tech.,This article is part of the On Tech newsletter. You can sign up here to receive it weekdays.,These companies have mastered spending big to stay Big Tech.,Amazon and Google’s True Advantage,These companies have mastered spending big to stay Big Tech. This article is part of the On Tech newsletter. You can sign up here to receive it weekdays. These companies have mastered spending big to stay Big Tech. Amazon and Google’s True Advantage ,3,1,0.0699999999999999,0.21,0.0,0
26,2021-09-21 14:16:36+00:00,1445,News,nyt://article/1598fe61-4bfa-5bb7-bcaf-11d4f1ab122e,"The technology giant has built a sprawling campus on the West Side of Manhattan and has 12,000 employees in the city.","Google announced on Tuesday that it would spend $2.1 billion to buy a sprawling Manhattan office building on the Hudson River waterfront, paying one of the largest prices in recent years for an office building in the United States and providing a jolt of optimism to a real estate industry lashed by the pandemic.","The technology giant has built a sprawling campus on the West Side of Manhattan and has 12,000 employees in the city.",Google to Spend $2.1 Billion on Manhattan Office Building,"The technology giant has built a sprawling campus on the West Side of Manhattan and has 12,000 employees in the city. Google announced on Tuesday that it would spend $2.1 billion to buy a sprawling Manhattan office building on the Hudson River waterfront, paying one of the largest prices in recent years for an office building in the United States and providing a jolt of optimism to a real estate industry lashed by the pandemic. The technology giant has built a sprawling campus on the West Side of Manhattan and has 12,000 employees in the city. Google to Spend $2.1 Billion on Manhattan Office Building ",1,2,0.05,0.6375,0.0,0
27,2020-10-20 22:53:17+00:00,922,News,nyt://article/15bcc832-e05e-518b-86fc-ad50a88efb9a,"The Justice Department’s antitrust case points to restrictive contracts, a focus that a professor said “is as old as the Sherman Act.”","Two weeks ago, House lawmakers concluded a 16-month investigation into Amazon, Apple, Google and Facebook and called for sweeping changes to curb their market power. The lawmakers’ verdict: Traditional antitrust laws aren’t up to the challenge, and the laws need their biggest overhaul in more than 40 years.","The Justice Department’s antitrust case points to restrictive contracts, a focus that a professor said “is as old as the Sherman Act.”",Google Up Against Laws That Thwarted Microsoft (and Others Since 1890),"The Justice Department’s antitrust case points to restrictive contracts, a focus that a professor said “is as old as the Sherman Act.” Two weeks ago, House lawmakers concluded a 16-month investigation into Amazon, Apple, Google and Facebook and called for sweeping changes to curb their market power. The lawmakers’ verdict: Traditional antitrust laws aren’t up to the challenge, and the laws need their biggest overhaul in more than 40 years. The Justice Department’s antitrust case points to restrictive contracts, a focus that a professor said “is as old as the Sherman Act.” Google Up Against Laws That Thwarted Microsoft (and Others Since 1890) ",2,2,0.175,0.4125,0.0,0
29,2021-02-16 08:00:08+00:00,1111,News,nyt://article/16b5151b-5e8a-5c92-bb6e-9c3446bec249,"Government antitrust lawsuits have created openings for numerous private cases against Big Tech, with more expected to come. If successful, the cases could cost them dearly.","Google is facing antitrust cases from Europe’s top competition enforcer, the Justice Department and attorneys general from more than 30 states and territories.","Government antitrust lawsuits have created openings for numerous private cases against Big Tech, with more expected to come. If successful, the cases could cost them dearly.",Big Tech’s Next Big Problem Could Come From People Like ‘Mr. Sweepy’,"Government antitrust lawsuits have created openings for numerous private cases against Big Tech, with more expected to come. If successful, the cases could cost them dearly. Google is facing antitrust cases from Europe’s top competition enforcer, the Justice Department and attorneys general from more than 30 states and territories. Government antitrust lawsuits have created openings for numerous private cases against Big Tech, with more expected to come. If successful, the cases could cost them dearly. Big Tech’s Next Big Problem Could Come From People Like ‘Mr. Sweepy’ ",5,1,0.1861111111111111,0.4083333333333333,0.0,0
30,2021-04-06 16:50:59+00:00,1057,News,nyt://article/174d765c-5f9e-5b58-bfaa-a0944cd59ffc,"In siding with Google, the Supreme Court gave software experts some love.",This article is part of the On Tech newsletter. You can sign up here to receive it weekdays.,"In siding with Google, the Supreme Court gave software experts some love.",Google Won. So Did Tech.,"In siding with Google, the Supreme Court gave software experts some love. This article is part of the On Tech newsletter. You can sign up here to receive it weekdays. In siding with Google, the Supreme Court gave software experts some love. Google Won. So Did Tech. ",3,3,0.5,0.6,0.0,0
31,2021-01-04 11:00:08+00:00,1467,News,nyt://article/17654f45-8243-538c-9948-54d87606948d,"The creation of the union, a rarity in Silicon Valley, follows years of increasing outspokenness by Google workers. Executives have struggled to handle the change.","OAKLAND, Calif. — More than 400 Google engineers and other workers have formed a union, the group revealed on Monday, capping years of growing activism at one of the world’s largest companies and presenting a rare beachhead for labor organizers in staunchly anti-union Silicon Valley.","The creation of the union, a rarity in Silicon Valley, follows years of increasing outspokenness by Google workers. Executives have struggled to handle the change.","Hundreds of Google Employees Unionize, Culminating Years of Activism","The creation of the union, a rarity in Silicon Valley, follows years of increasing outspokenness by Google workers. Executives have struggled to handle the change. OAKLAND, Calif. — More than 400 Google engineers and other workers have formed a union, the group revealed on Monday, capping years of growing activism at one of the world’s largest companies and presenting a rare beachhead for labor organizers in staunchly anti-union Silicon Valley. The creation of the union, a rarity in Silicon Valley, follows years of increasing outspokenness by Google workers. Executives have struggled to handle the change. Hundreds of Google Employees Unionize, Culminating Years of Activism ",5,4,0.225,0.5916666666666667,-0.7757279276847839,-1
33,2020-12-21 23:56:15+00:00,561,News,nyt://article/18952d0f-a173-5c9a-9e51-4ae4cebdb99c,"The company said people use its services because they choose to, not because they lack alternatives.","Google said on Monday that it had not used its multibillion-dollar deals with other large tech firms to protect its position as the dominant online search engine, in the company’s first formal rebuttal to the Justice Department’s accusations that those deals violated antitrust laws.","The company said people use its services because they choose to, not because they lack alternatives.",Google Denies Antitrust Claims in Early Response to U.S. Lawsuit,"The company said people use its services because they choose to, not because they lack alternatives. Google said on Monday that it had not used its multibillion-dollar deals with other large tech firms to protect its position as the dominant online search engine, in the company’s first formal rebuttal to the Justice Department’s accusations that those deals violated antitrust laws. The company said people use its services because they choose to, not because they lack alternatives. Google Denies Antitrust Claims in Early Response to U.S. Lawsuit ",5,2,0.1098214285714285,0.3592261904761905,-0.6747299432754517,-1
