,pub_date,word_count,type_of_material,_id,abstract,lead_paragraph,snippet,headline.main,text,relevance_rank,keyword_counts,polarity,subjectivity,finbert-sentiment-score,finbert-bin
155,2020-07-20 17:35:34+00:00,1192,News,nyt://article/997ffa2b-a9ea-5767-b42c-e739ddd2b0c2,Some government agencies that use the software said they were surprised that Google may pick up the locations of certain app users. Others said they had unsuccessfully pushed Google to make a change.,"When Google and Apple announced plans in April for free software to help alert people of their possible exposure to the coronavirus, the companies promoted it as “privacy preserving” and said it would not track users’ locations. Encouraged by those guarantees, Germany, Switzerland and other countries used the code to develop national virus alert apps that have been downloaded more than 20 million times.",Some government agencies that use the software said they were surprised that Google may pick up the locations of certain app users. Others said they had unsuccessfully pushed Google to make a change.,Google Promises Privacy With Virus App but Can Still Collect Location Data,"Some government agencies that use the software said they were surprised that Google may pick up the locations of certain app users. Others said they had unsuccessfully pushed Google to make a change. When Google and Apple announced plans in April for free software to help alert people of their possible exposure to the coronavirus, the companies promoted it as “privacy preserving” and said it would not track users’ locations. Encouraged by those guarantees, Germany, Switzerland and other countries used the code to develop national virus alert apps that have been downloaded more than 20 million times. Some government agencies that use the software said they were surprised that Google may pick up the locations of certain app users. Others said they had unsuccessfully pushed Google to make a change. Google Promises Privacy With Virus App but Can Still Collect Location Data ",5,6,0.1754464285714286,0.7022321428571429,0.0,0
157,2020-09-24 16:47:30+00:00,1161,News,nyt://article/9b8d4285-9764-586a-bea6-16eeeafc2152,Google is facing the possibility of multiple antitrust lawsuits. Here’s why and what’s ahead.,This article is part of the On Tech newsletter. You can sign up here to receive it weekdays.,Google is facing the possibility of multiple antitrust lawsuits. Here’s why and what’s ahead.,What’s the Deal With Google Now?,Google is facing the possibility of multiple antitrust lawsuits. Here’s why and what’s ahead. This article is part of the On Tech newsletter. You can sign up here to receive it weekdays. Google is facing the possibility of multiple antitrust lawsuits. Here’s why and what’s ahead. What’s the Deal With Google Now? ,2,3,0.0,0.0,0.0,0
162,2021-03-25 22:45:22+00:00,1246,News,nyt://article/a1f18a98-7127-5ae4-922b-337deddf843b,"The leaders of Google, Facebook and Twitter faced sharp questions about misinformation’s role in the attack and the mental health of children who use their products.","WASHINGTON — Lawmakers grilled the leaders of Facebook, Google and Twitter on Thursday about the connection between online disinformation and the Jan. 6 riot at the Capitol, causing Twitter’s chief executive to publicly admit for the first time that his product had played a role in the events that left five people dead.","The leaders of Google, Facebook and Twitter faced sharp questions about misinformation’s role in the attack and the mental health of children who use their products.","Lawmakers Grill Tech C.E.O.s on Capitol Riot, Getting Few Direct Answers","The leaders of Google, Facebook and Twitter faced sharp questions about misinformation’s role in the attack and the mental health of children who use their products. WASHINGTON — Lawmakers grilled the leaders of Facebook, Google and Twitter on Thursday about the connection between online disinformation and the Jan. 6 riot at the Capitol, causing Twitter’s chief executive to publicly admit for the first time that his product had played a role in the events that left five people dead. The leaders of Google, Facebook and Twitter faced sharp questions about misinformation’s role in the attack and the mental health of children who use their products. Lawmakers Grill Tech C.E.O.s on Capitol Riot, Getting Few Direct Answers ",4,3,-0.05,0.32,-0.8617914319038391,-1
164,2020-10-29 09:00:07+00:00,247,Op-Ed,nyt://article/a2bc9142-0261-5aed-9961-e224b031c690,How antitrust lawyer Lina Khan is taking on the most powerful men in Silicon Valley.,"It finally looks as if Big Tech may face some breakups. Lawmakers are interrogating tech C.E.O.s on Capitol Hill while the Justice Department pursues a landmark antitrust case against Google. For decades, tech giants have avoided such scrutiny — hiding behind the idea that their products are free, beneficial, even beloved.",How antitrust lawyer Lina Khan is taking on the most powerful men in Silicon Valley.,She’s Bursting Big Tech’s Bubble,"How antitrust lawyer Lina Khan is taking on the most powerful men in Silicon Valley. It finally looks as if Big Tech may face some breakups. Lawmakers are interrogating tech C.E.O.s on Capitol Hill while the Justice Department pursues a landmark antitrust case against Google. For decades, tech giants have avoided such scrutiny — hiding behind the idea that their products are free, beneficial, even beloved. How antitrust lawyer Lina Khan is taking on the most powerful men in Silicon Valley. She’s Bursting Big Tech’s Bubble ",3,1,0.209090909090909,0.6545454545454544,0.0,0
166,2020-09-01 20:14:30+00:00,723,News,nyt://article/a41e9f5b-e443-5fe0-b8b7-3c5b2791b1bf,"The tech giants said states could soon send notices directly to smartphones asking people to opt in to the technology, which helps trace the coronavirus.",Several state governments may soon send residents an alert asking them to turn on “exposure notifications.”,"The tech giants said states could soon send notices directly to smartphones asking people to opt in to the technology, which helps trace the coronavirus.",Apple and Google to Make It Easier to Opt In to Virus Tracing,"The tech giants said states could soon send notices directly to smartphones asking people to opt in to the technology, which helps trace the coronavirus. Several state governments may soon send residents an alert asking them to turn on “exposure notifications.” The tech giants said states could soon send notices directly to smartphones asking people to opt in to the technology, which helps trace the coronavirus. Apple and Google to Make It Easier to Opt In to Virus Tracing ",2,1,0.0666666666666666,0.2666666666666666,0.0,0
167,2021-02-17 15:32:03+00:00,1260,News,nyt://article/a52c8d5e-d5a4-5cd4-a187-c66d3f974e93,"With Australia moving to make the tech companies pay for news, Facebook took a hard line, while Google has struck deals to pay publishers.","SAN FRANCISCO — For months, Facebook and Google have been locked in a stare-down with news publishers and lawmakers in Australia.","With Australia moving to make the tech companies pay for news, Facebook took a hard line, while Google has struck deals to pay publishers.","Facebook Blocks News in Australia, Diverging With Google on Proposed Law","With Australia moving to make the tech companies pay for news, Facebook took a hard line, while Google has struck deals to pay publishers. SAN FRANCISCO — For months, Facebook and Google have been locked in a stare-down with news publishers and lawmakers in Australia. With Australia moving to make the tech companies pay for news, Facebook took a hard line, while Google has struck deals to pay publishers. Facebook Blocks News in Australia, Diverging With Google on Proposed Law ",3,4,-0.2916666666666667,0.5416666666666666,-0.9380233883857728,-2
168,2020-12-11 17:31:13+00:00,1200,News,nyt://article/a5385b89-2924-534e-ad77-5c52c51180cf,These Google and Apple apps work and aren’t stealing all your data. More people should use them.,This article is part of the On Tech newsletter. You can sign up here to receive it weekdays.,These Google and Apple apps work and aren’t stealing all your data. More people should use them.,Give Virus Alert Apps a Shot,These Google and Apple apps work and aren’t stealing all your data. More people should use them. This article is part of the On Tech newsletter. You can sign up here to receive it weekdays. These Google and Apple apps work and aren’t stealing all your data. More people should use them. Give Virus Alert Apps a Shot ,3,2,0.5,0.5,0.0,0
169,2021-11-03 18:37:43+00:00,1302,News,nyt://article/a5f78e5e-b7ea-5778-a611-3fcbcf1cfc1f,"Three years ago, the company walked away from a Defense Department project after employees objected to it. Now the company is working on a new proposal for the Pentagon.","Three years after an employee revolt forced Google to abandon work on a Pentagon program that used artificial intelligence, the company is aggressively pursuing a major contract to provide its technology to the military.","Three years ago, the company walked away from a Defense Department project after employees objected to it. Now the company is working on a new proposal for the Pentagon.","Google Wants to Work With the Pentagon Again, Despite Employee Concerns","Three years ago, the company walked away from a Defense Department project after employees objected to it. Now the company is working on a new proposal for the Pentagon. Three years after an employee revolt forced Google to abandon work on a Pentagon program that used artificial intelligence, the company is aggressively pursuing a major contract to provide its technology to the military. Three years ago, the company walked away from a Defense Department project after employees objected to it. Now the company is working on a new proposal for the Pentagon. Google Wants to Work With the Pentagon Again, Despite Employee Concerns ",1,2,-0.0663961038961039,0.4012987012987013,-0.479465901851654,0
171,2021-07-13 11:27:13+00:00,471,News,nyt://article/a74adbf1-06f1-5d43-b5bc-5a61eeb07f6f,French officials said Google had ignored a 2020 order from regulators to negotiate a licensing deal with publishers to use short blurbs from articles in search results.,"Google was fined 500 million euros, or $593 million, by French antitrust authorities on Tuesday for failing to negotiate a deal in “good faith” with publishers to carry news on its platform, a victory for media companies that have been fighting to make up for a drop in advertising revenue that they attribute to the Silicon Valley giant.",French officials said Google had ignored a 2020 order from regulators to negotiate a licensing deal with publishers to use short blurbs from articles in search results.,France fines Google $593 million for not negotiating ‘in good faith’ with news publishers.,"French officials said Google had ignored a 2020 order from regulators to negotiate a licensing deal with publishers to use short blurbs from articles in search results. Google was fined 500 million euros, or $593 million, by French antitrust authorities on Tuesday for failing to negotiate a deal in “good faith” with publishers to carry news on its platform, a victory for media companies that have been fighting to make up for a drop in advertising revenue that they attribute to the Silicon Valley giant. French officials said Google had ignored a 2020 order from regulators to negotiate a licensing deal with publishers to use short blurbs from articles in search results. France fines Google $593 million for not negotiating ‘in good faith’ with news publishers. ",2,4,0.175,0.35,-0.9624982476234436,-2
172,2020-07-21 19:18:43+00:00,788,News,nyt://article/a7ee5ea2-4306-5c1a-99bc-f75bea16cee9,"What happens when you invite staff members to make a Google Doc, write about what they’re thinking and doing during the pandemic, and make it public? “Notes From Our Homes to Yours” brings journalists and readers closer.","Times Insider explains who we are and what we do, and delivers behind-the-scenes insights into how our journalism comes together.","What happens when you invite staff members to make a Google Doc, write about what they’re thinking and doing during the pandemic, and make it public? “Notes From Our Homes to Yours” brings journalists and readers closer.",The New York Times Has Shared a File With You,"What happens when you invite staff members to make a Google Doc, write about what they’re thinking and doing during the pandemic, and make it public? “Notes From Our Homes to Yours” brings journalists and readers closer. Times Insider explains who we are and what we do, and delivers behind-the-scenes insights into how our journalism comes together. What happens when you invite staff members to make a Google Doc, write about what they’re thinking and doing during the pandemic, and make it public? “Notes From Our Homes to Yours” brings journalists and readers closer. The New York Times Has Shared a File With You ",1,2,0.0454545454545454,0.1959595959595959,0.0,0
173,2020-05-16 00:04:23+00:00,754,News,nyt://article/a9864d64-3cb4-51a7-96eb-f3aad88c0e6c,The case may be joined by state attorneys general in what would be one of the biggest antitrust actions by the United States since the late 1990s.,"WASHINGTON — The Justice Department is planning to file antitrust charges against Google as early as this summer, said two people with knowledge of the situation, in what would be one of the biggest antitrust actions by the United States since the late 1990s.",The case may be joined by state attorneys general in what would be one of the biggest antitrust actions by the United States since the late 1990s.,U.S. Is Said to Plan to File Antitrust Charges Against Google,"The case may be joined by state attorneys general in what would be one of the biggest antitrust actions by the United States since the late 1990s. WASHINGTON — The Justice Department is planning to file antitrust charges against Google as early as this summer, said two people with knowledge of the situation, in what would be one of the biggest antitrust actions by the United States since the late 1990s. The case may be joined by state attorneys general in what would be one of the biggest antitrust actions by the United States since the late 1990s. U.S. Is Said to Plan to File Antitrust Charges Against Google ",1,2,-0.1166666666666666,0.5166666666666667,0.0,0
177,2020-04-10 17:01:26+00:00,1184,News,nyt://article/abb4fc61-2784-5aab-b10f-e2bcbf9832ce,The technology giants said they would embed a feature in iPhones and Android devices to enable users to track infected people they’d come close to.,"OAKLAND, Calif. — In one of the most far-ranging attempts to halt the spread of the coronavirus, Apple and Google said they were building software into smartphones that would tell people if they were recently in contact with someone who was infected with it.",The technology giants said they would embed a feature in iPhones and Android devices to enable users to track infected people they’d come close to.,Apple and Google Team Up to ‘Contact Trace’ the Coronavirus,"The technology giants said they would embed a feature in iPhones and Android devices to enable users to track infected people they’d come close to. OAKLAND, Calif. — In one of the most far-ranging attempts to halt the spread of the coronavirus, Apple and Google said they were building software into smartphones that would tell people if they were recently in contact with someone who was infected with it. The technology giants said they would embed a feature in iPhones and Android devices to enable users to track infected people they’d come close to. Apple and Google Team Up to ‘Contact Trace’ the Coronavirus ",1,2,0.25,0.375,0.0,0
186,2020-04-19 19:00:05+00:00,708,Op-Ed,nyt://article/ba319f5b-877c-52e8-9329-444b9b816a22,The U.S. should emulate the French government’s resolve to fight for the news media industry.,"Much of the news business is being hammered by the decline in advertising because of Covid-19, just when the public most needs reliable information. While digital audiences are way up, the rapid contraction in revenue has so far caused 33,000 news media employees to be furloughed, to be laid off or to suffer reduced pay.",The U.S. should emulate the French government’s resolve to fight for the news media industry.,Google and Facebook Must Pay for Local Journalism,"The U.S. should emulate the French government’s resolve to fight for the news media industry. Much of the news business is being hammered by the decline in advertising because of Covid-19, just when the public most needs reliable information. While digital audiences are way up, the rapid contraction in revenue has so far caused 33,000 news media employees to be furloughed, to be laid off or to suffer reduced pay. The U.S. should emulate the French government’s resolve to fight for the news media industry. Google and Facebook Must Pay for Local Journalism ",1,1,0.0999999999999999,0.2208333333333333,-0.959961712360382,-2
188,2020-04-14 17:02:53+00:00,1157,News,nyt://article/bda00697-bc3d-5e59-9632-7a770a6947ff,"Though ad sales at the two companies are expected to be down, they are likely to fare better than smaller peers and publishers.","OAKLAND, Calif. — Google’s and Facebook’s advertising businesses, which have roughly tripled in combined size over the last five years, may be headed for a rare stumble as the coronavirus pushes the global economy into a tailspin.","Though ad sales at the two companies are expected to be down, they are likely to fare better than smaller peers and publishers.",Even Google and Facebook May Face an Ad Slump,"Though ad sales at the two companies are expected to be down, they are likely to fare better than smaller peers and publishers. OAKLAND, Calif. — Google’s and Facebook’s advertising businesses, which have roughly tripled in combined size over the last five years, may be headed for a rare stumble as the coronavirus pushes the global economy into a tailspin. Though ad sales at the two companies are expected to be down, they are likely to fare better than smaller peers and publishers. Even Google and Facebook May Face an Ad Slump ",5,2,0.0425925925925925,0.4562962962962963,-0.97007018327713,-2
190,2021-03-27 09:00:13+00:00,1289,News,nyt://article/bef450ab-d7ea-5db7-bb83-6566b3a19b47,Google presents itself to independent sellers as cheaper and less restrictive. But it is not clear whether it can change people’s habits of going straight to Amazon.,"OAKLAND, Calif. — Google tried to copy Amazon’s playbook to become the shopping hub of the internet, with little success. Now it is trying something different: the anti-Amazon strategy.",Google presents itself to independent sellers as cheaper and less restrictive. But it is not clear whether it can change people’s habits of going straight to Amazon.,Google Aims to Be the Anti-Amazon of E-Commerce. It Has a Long Way to Go.,"Google presents itself to independent sellers as cheaper and less restrictive. But it is not clear whether it can change people’s habits of going straight to Amazon. OAKLAND, Calif. — Google tried to copy Amazon’s playbook to become the shopping hub of the internet, with little success. Now it is trying something different: the anti-Amazon strategy. Google presents itself to independent sellers as cheaper and less restrictive. But it is not clear whether it can change people’s habits of going straight to Amazon. Google Aims to Be the Anti-Amazon of E-Commerce. It Has a Long Way to Go. ",1,4,0.0024305555555555,0.2875,0.0,0
192,2021-05-03 16:10:35+00:00,1199,News,nyt://article/c0c7059c-dab9-51b2-adb5-b87c97f52df7,Google plans to experiment with new office configurations and more flexibility. Will others follow?,This article is part of the On Tech newsletter. You can sign up here to receive it weekdays.,Google plans to experiment with new office configurations and more flexibility. Will others follow?,Back to Work the Google Way,Google plans to experiment with new office configurations and more flexibility. Will others follow? This article is part of the On Tech newsletter. You can sign up here to receive it weekdays. Google plans to experiment with new office configurations and more flexibility. Will others follow? Back to Work the Google Way ,4,3,0.2545454545454545,0.3818181818181818,0.0,0
193,2020-07-07 10:31:35+00:00,980,News,nyt://article/c2ddbead-f79f-581e-900f-3b7edb9d2259,"A commercial deal in Kenya marks the first application of balloon-powered internet in Africa, the region with the lowest percentage of internet users globally.","NAIROBI, Kenya — A fleet of high-altitude balloons started delivering internet service to Kenya on Tuesday, extending online access to tens of thousands of people in the first-ever commercial deployment of the technology.","A commercial deal in Kenya marks the first application of balloon-powered internet in Africa, the region with the lowest percentage of internet users globally.","A Bird? A Plane? No, It’s a Google Balloon Beaming the Internet","A commercial deal in Kenya marks the first application of balloon-powered internet in Africa, the region with the lowest percentage of internet users globally. NAIROBI, Kenya — A fleet of high-altitude balloons started delivering internet service to Kenya on Tuesday, extending online access to tens of thousands of people in the first-ever commercial deployment of the technology. A commercial deal in Kenya marks the first application of balloon-powered internet in Africa, the region with the lowest percentage of internet users globally. A Bird? A Plane? No, It’s a Google Balloon Beaming the Internet ",2,1,0.0714285714285714,0.0952380952380952,0.0,0
196,2020-04-28 22:08:52+00:00,433,News,nyt://article/c80682c0-f950-5d8f-b46e-689163290b6c,The chief executive of Google’s parent company said it experienced a “significant and sudden slowdown” in advertising in March.,"OAKLAND, Calif. — Until the coronavirus took hold in the United States, Google’s parent company, Alphabet, was marching forward to another predictably strong quarter.",The chief executive of Google’s parent company said it experienced a “significant and sudden slowdown” in advertising in March.,"Alphabet’s Profit Is Up, but Company Warns of Difficulties","The chief executive of Google’s parent company said it experienced a “significant and sudden slowdown” in advertising in March. OAKLAND, Calif. — Until the coronavirus took hold in the United States, Google’s parent company, Alphabet, was marching forward to another predictably strong quarter. The chief executive of Google’s parent company said it experienced a “significant and sudden slowdown” in advertising in March. Alphabet’s Profit Is Up, but Company Warns of Difficulties ",1,3,0.3976190476190476,0.7547619047619047,-0.8996315598487854,-1
197,2020-09-28 17:03:44+00:00,648,News,nyt://article/c84e5c29-85cb-55f1-9210-437120e76135,Some companies like Netflix and Spotify had avoided making the payment when people paid for something inside their apps.,"OAKLAND, Calif. — Google said it would no longer allow any apps to circumvent its payment system within the Google Play store that provides the company a cut of in-app purchases.",Some companies like Netflix and Spotify had avoided making the payment when people paid for something inside their apps.,Google Demands 30% Cut From App Developers in Its Play Store,"Some companies like Netflix and Spotify had avoided making the payment when people paid for something inside their apps. OAKLAND, Calif. — Google said it would no longer allow any apps to circumvent its payment system within the Google Play store that provides the company a cut of in-app purchases. Some companies like Netflix and Spotify had avoided making the payment when people paid for something inside their apps. Google Demands 30% Cut From App Developers in Its Play Store ",5,3,0.0,0.0,-0.6878215670585632,-1
200,2020-03-23 09:00:30+00:00,1833,News,nyt://article/c95046e1-2b7b-5a62-9991-dbfa4f622e0b,"As chief executives hunker down during the pandemic, home offices have become corporate headquarters.","On Thursday morning, Chuck Robbins, the chief executive of Cisco, signed on to an companywide video conference from his home office in Silicon Valley. The connection was stable, but the quality was not great.","As chief executives hunker down during the pandemic, home offices have become corporate headquarters.","Logged On From the Laundry Room: How the C.E.O.s of Google, Pfizer and Slack Work From Home","As chief executives hunker down during the pandemic, home offices have become corporate headquarters. On Thursday morning, Chuck Robbins, the chief executive of Cisco, signed on to an companywide video conference from his home office in Silicon Valley. The connection was stable, but the quality was not great. As chief executives hunker down during the pandemic, home offices have become corporate headquarters. Logged On From the Laundry Room: How the C.E.O.s of Google, Pfizer and Slack Work From Home ",5,1,-0.1422222222222222,0.2655555555555556,0.0,0
