,pub_date,abstract,lead_paragraph,snippet,headline.main,text,polarity,subjectivity
271,2022-05-17 20:41:42+00:00,"Crypto boosters such as Matt Damon, Reese Witherspoon and Gwyneth Paltrow have been criticized for hyping virtual currency without highlighting the risks.","In the latest commercial from the virtual currency exchange Crypto.com, titled “Bravery Is a Process,” the star basketball player Joel Embiid walks through Philadelphia while Bill Self, his former college coach, lends the narration.","Crypto boosters such as Matt Damon, Reese Witherspoon and Gwyneth Paltrow have been criticized for hyping virtual currency without highlighting the risks.",All Those Celebrities Pushing Crypto Are Not So Vocal Now,"Crypto boosters such as Matt Damon, Reese Witherspoon and Gwyneth Paltrow have been criticized for hyping virtual currency without highlighting the risks. In the latest commercial from the virtual currency exchange Crypto.com, titled “Bravery Is a Process,” the star basketball player Joel Embiid walks through Philadelphia while Bill Self, his former college coach, lends the narration. Crypto boosters such as Matt Damon, Reese Witherspoon and Gwyneth Paltrow have been criticized for hyping virtual currency without highlighting the risks. All Those Celebrities Pushing Crypto Are Not So Vocal Now ",0.1,0.38
272,2022-03-23 16:44:14+00:00,"Unlike so many of our online experiences, shopping is one area that has remained mostly local.","Many apps that Americans use are also popular across the world, at least outside China. Facebook, WhatsApp, Google and YouTube, TikTok, Uber and Netflix are shared global experiences.","Unlike so many of our online experiences, shopping is one area that has remained mostly local.",There’s No Global Shopping Mall,"Unlike so many of our online experiences, shopping is one area that has remained mostly local. Many apps that Americans use are also popular across the world, at least outside China. Facebook, WhatsApp, Google and YouTube, TikTok, Uber and Netflix are shared global experiences. Unlike so many of our online experiences, shopping is one area that has remained mostly local. There’s No Global Shopping Mall ",0.18,0.285
273,2022-05-05 16:52:41+00:00,Sometimes we want experts who can sort out the mess online.,Gatekeepers like powerful tech companies have a bad reputation for controlling what happens online. But they don’t completely deserve the heat.,Sometimes we want experts who can sort out the mess online.,Online Deciders Like Apple Have a Point,Sometimes we want experts who can sort out the mess online. Gatekeepers like powerful tech companies have a bad reputation for controlling what happens online. But they don’t completely deserve the heat. Sometimes we want experts who can sort out the mess online. Online Deciders Like Apple Have a Point ,-0.12999999999999998,0.4833333333333333
274,2022-02-22 17:40:16+00:00,Apple is making a stink over a Dutch regulator’s effort to change its app store. Here’s why the tech giant cares.,This article is part of the On Tech newsletter. Here is a collection of past columns.,Apple is making a stink over a Dutch regulator’s effort to change its app store. Here’s why the tech giant cares.,Why Apple’s Fight in the Netherlands Matters,Apple is making a stink over a Dutch regulator’s effort to change its app store. Here’s why the tech giant cares. This article is part of the On Tech newsletter. Here is a collection of past columns. Apple is making a stink over a Dutch regulator’s effort to change its app store. Here’s why the tech giant cares. Why Apple’s Fight in the Netherlands Matters ,-0.08333333333333333,0.75
275,2022-04-06 16:42:46+00:00,"Old-school media companies are challenging the streaming star, which needs new ways to stay on top.",It’s a question that’s almost as old as Netflix: How long can we have the world’s favorite streaming video service with no commercials?,"Old-school media companies are challenging the streaming star, which needs new ways to stay on top.",The Old-Timers Are Chasing Netflix,"Old-school media companies are challenging the streaming star, which needs new ways to stay on top. It’s a question that’s almost as old as Netflix: How long can we have the world’s favorite streaming video service with no commercials? Old-school media companies are challenging the streaming star, which needs new ways to stay on top. The Old-Timers Are Chasing Netflix ",0.31363636363636366,0.6121212121212121
276,2022-03-07 10:00:16+00:00,"Jill Hazelbaker, a top executive, helped the ride-hailing company weather sexual assault accusations with a change in practices and fresh messaging.","Jill Hazelbaker, 40, a former political spokeswoman, is the senior vice president of marketing and public affairs for Uber. ","Jill Hazelbaker, a top executive, helped the ride-hailing company weather sexual assault accusations with a change in practices and fresh messaging.",Shifting Uber’s Narrative from Crisis to Safety,"Jill Hazelbaker, a top executive, helped the ride-hailing company weather sexual assault accusations with a change in practices and fresh messaging. Jill Hazelbaker, 40, a former political spokeswoman, is the senior vice president of marketing and public affairs for Uber.  Jill Hazelbaker, a top executive, helped the ride-hailing company weather sexual assault accusations with a change in practices and fresh messaging. Shifting Uber’s Narrative from Crisis to Safety ",0.28888888888888886,0.425925925925926
277,2022-09-07 12:12:51+00:00,"The billionaire can amend his lawsuit to include claims from a Twitter whistle-blower, but lost an effort to delay a trial over whether he could drop his bid to buy the company.","Some potential major cracks are beginning to appear in Elon Musk’s suit to undo his $44 billion acquisition of Twitter, yesterday’s hearing in Delaware’s Court of Chancery revealed. But Musk has also scored a major victory.","The billionaire can amend his lawsuit to include claims from a Twitter whistle-blower, but lost an effort to delay a trial over whether he could drop his bid to buy the company.",Judge Hands Elon Musk a Win in Court,"The billionaire can amend his lawsuit to include claims from a Twitter whistle-blower, but lost an effort to delay a trial over whether he could drop his bid to buy the company. Some potential major cracks are beginning to appear in Elon Musk’s suit to undo his $44 billion acquisition of Twitter, yesterday’s hearing in Delaware’s Court of Chancery revealed. But Musk has also scored a major victory. The billionaire can amend his lawsuit to include claims from a Twitter whistle-blower, but lost an effort to delay a trial over whether he could drop his bid to buy the company. Judge Hands Elon Musk a Win in Court ",0.23125,0.6
278,2022-06-03 20:00:06+00:00,The Meta C.O.O. leaves a legacy of stunning financial success — and a company still in denial about its toxic impact.,When exactly is the right time to exit the limelight?,The Meta C.O.O. leaves a legacy of stunning financial success — and a company still in denial about its toxic impact.,Sheryl Sandberg’s Long (Overdue) Goodbye,The Meta C.O.O. leaves a legacy of stunning financial success — and a company still in denial about its toxic impact. When exactly is the right time to exit the limelight? The Meta C.O.O. leaves a legacy of stunning financial success — and a company still in denial about its toxic impact. Sheryl Sandberg’s Long (Overdue) Goodbye ,0.23174603174603176,0.35396825396825393
279,2022-02-25 00:00:04+00:00,The ex-president’s much-touted Truth Social app fails to dazzle.,"Donald Trump’s out with his new app, Truth Social, and, to describe it in a few words, it’s more of an antisocial network.",The ex-president’s much-touted Truth Social app fails to dazzle.,"Donald Trump’s Glitchy, Snaggy Social Media Rollout","The ex-president’s much-touted Truth Social app fails to dazzle. Donald Trump’s out with his new app, Truth Social, and, to describe it in a few words, it’s more of an antisocial network. The ex-president’s much-touted Truth Social app fails to dazzle. Donald Trump’s Glitchy, Snaggy Social Media Rollout ",-0.04781144781144782,0.21346801346801347
280,2022-02-10 10:00:15+00:00,"Is Illumina, a gene-sequencing powerhouse, trying to speed innovation in the field of cancer blood tests or thwart it with an acquisition?","Illumina, the leading maker of gene-sequencing machines, is tiny compared with the tech giants of Silicon Valley. But like Google and Facebook, Illumina now finds itself in the cross hairs of antitrust enforcers in the United States and Europe.","Is Illumina, a gene-sequencing powerhouse, trying to speed innovation in the field of cancer blood tests or thwart it with an acquisition?",A Gene Sequencing Pioneer Battles Over What It Can Buy,"Is Illumina, a gene-sequencing powerhouse, trying to speed innovation in the field of cancer blood tests or thwart it with an acquisition? Illumina, the leading maker of gene-sequencing machines, is tiny compared with the tech giants of Silicon Valley. But like Google and Facebook, Illumina now finds itself in the cross hairs of antitrust enforcers in the United States and Europe. Is Illumina, a gene-sequencing powerhouse, trying to speed innovation in the field of cancer blood tests or thwart it with an acquisition? A Gene Sequencing Pioneer Battles Over What It Can Buy ",0.0,0.25
281,2022-03-29 11:11:45+00:00,The White House’s latest budget proposal enumerates its biggest policy priorities.,"President Biden proposed a $5.8 trillion annual budget yesterday, a request that reflects growing security and economic concerns at home and abroad. There are billions set aside to invest in police departments and the military, paid for in part by higher taxes on corporations and the wealthy.",The White House’s latest budget proposal enumerates its biggest policy priorities.,Inside Biden’s $5.8 Trillion Wish List,"The White House’s latest budget proposal enumerates its biggest policy priorities. President Biden proposed a $5.8 trillion annual budget yesterday, a request that reflects growing security and economic concerns at home and abroad. There are billions set aside to invest in police departments and the military, paid for in part by higher taxes on corporations and the wealthy. The White House’s latest budget proposal enumerates its biggest policy priorities. Inside Biden’s $5.8 Trillion Wish List ",0.23125,0.45
282,2022-06-24 12:53:30+00:00,"Plus, Intel pressures Congress to provide funding for U.S. chip production.","Yesterday’s sweeping Supreme Court decision striking down a New York State law that restricted concealed weapons is likely to set off another round of soul searching among law firms, banks and others about whether to work with the gun industry and its allies.","Plus, Intel pressures Congress to provide funding for U.S. chip production.",After the Gun Ruling,"Plus, Intel pressures Congress to provide funding for U.S. chip production. Yesterday’s sweeping Supreme Court decision striking down a New York State law that restricted concealed weapons is likely to set off another round of soul searching among law firms, banks and others about whether to work with the gun industry and its allies. Plus, Intel pressures Congress to provide funding for U.S. chip production. After the Gun Ruling ",0.056161616161616155,0.6286868686868687
283,2022-06-07 13:38:07+00:00,"The Lone Star State enters the Musk-Twitter fray, highlighting Texas’ willingness, and Republicans in general, to break with traditional free market thinking.","Target announced this morning that it had misjudged consumer demand and over-ordered goods, which will hurt profits. U.S. stock markets headed lower on the news, which has renewed fears that the economy will slow as consumers shut their wallets despite the strong job market. More here. ","The Lone Star State enters the Musk-Twitter fray, highlighting Texas’ willingness, and Republicans in general, to break with traditional free market thinking.",Don’t Mess With Texas,"The Lone Star State enters the Musk-Twitter fray, highlighting Texas’ willingness, and Republicans in general, to break with traditional free market thinking. Target announced this morning that it had misjudged consumer demand and over-ordered goods, which will hurt profits. U.S. stock markets headed lower on the news, which has renewed fears that the economy will slow as consumers shut their wallets despite the strong job market. More here.  The Lone Star State enters the Musk-Twitter fray, highlighting Texas’ willingness, and Republicans in general, to break with traditional free market thinking. Don’t Mess With Texas ",0.1358333333333333,0.5908333333333333
284,2022-01-05 12:48:04+00:00,"Organizers insist that the conference, which formally kicks off today, had to return in-person.","After going virtual last year, the Consumer Electronics Show, a mega-conference in Las Vegas that’s the traditional launchpad for many of the tech industry’s latest gadgets, is trying to make a comeback. CES kicks off today, with an estimated 2,200 exhibitors set to show up in person. But with the highly contagious Omicron variant of the coronavirus surging, scores of major tech companies are still presenting mostly virtually.","Organizers insist that the conference, which formally kicks off today, had to return in-person.",CES Tests an Appetite for Live Events,"Organizers insist that the conference, which formally kicks off today, had to return in-person. After going virtual last year, the Consumer Electronics Show, a mega-conference in Las Vegas that’s the traditional launchpad for many of the tech industry’s latest gadgets, is trying to make a comeback. CES kicks off today, with an estimated 2,200 exhibitors set to show up in person. But with the highly contagious Omicron variant of the coronavirus surging, scores of major tech companies are still presenting mostly virtually. Organizers insist that the conference, which formally kicks off today, had to return in-person. CES Tests an Appetite for Live Events ",0.23235795454545455,0.5320833333333334
285,2022-06-06 13:50:37+00:00,The President’s comment on Friday dismissing the billionaire entrepreneur is the latest barb in Biden’s unfortunate feud.,Andrew here.,The President’s comment on Friday dismissing the billionaire entrepreneur is the latest barb in Biden’s unfortunate feud.,Biden v. Musk,The President’s comment on Friday dismissing the billionaire entrepreneur is the latest barb in Biden’s unfortunate feud. Andrew here. The President’s comment on Friday dismissing the billionaire entrepreneur is the latest barb in Biden’s unfortunate feud. Biden v. Musk ,0.0,0.95
286,2022-08-22 10:27:59+00:00,"Age, innovation, antitrust and the metaverse.","In October of last year, my colleague Kevin Roose wrote a column titled, “Facebook Is Weaker Than We Knew.” His hook was a series of stories in The Wall Street Journal, based on internal company documents, which revealed the company’s failure to stop content that damaged teen mental health, spread vaccine misinformation and more.","Age, innovation, antitrust and the metaverse.",Facebook’s Four Problems,"Age, innovation, antitrust and the metaverse. In October of last year, my colleague Kevin Roose wrote a column titled, “Facebook Is Weaker Than We Knew.” His hook was a series of stories in The Wall Street Journal, based on internal company documents, which revealed the company’s failure to stop content that damaged teen mental health, spread vaccine misinformation and more. Age, innovation, antitrust and the metaverse. Facebook’s Four Problems ",0.013888888888888876,0.17777777777777778
287,2022-10-20 17:20:16+00:00,"Ahead of the midterm elections, the proliferation of alternative social media sites has helped cement false and misleading information as a defining feature of American politics.","On the morning of July 8, former President Donald J. Trump took to Truth Social, a social media platform he founded with people close to him, to claim that he had in fact won the 2020 presidential vote in Wisconsin, despite all evidence to the contrary.","Ahead of the midterm elections, the proliferation of alternative social media sites has helped cement false and misleading information as a defining feature of American politics.",How Disinformation Splintered and Became More Intractable,"Ahead of the midterm elections, the proliferation of alternative social media sites has helped cement false and misleading information as a defining feature of American politics. On the morning of July 8, former President Donald J. Trump took to Truth Social, a social media platform he founded with people close to him, to claim that he had in fact won the 2020 presidential vote in Wisconsin, despite all evidence to the contrary. Ahead of the midterm elections, the proliferation of alternative social media sites has helped cement false and misleading information as a defining feature of American politics. How Disinformation Splintered and Became More Intractable ",-0.016666666666666684,0.19666666666666666
288,2022-02-08 13:21:36+00:00,"Rumors, restructuring and resignations loom over the former high-flying fitness company.","Where is Peloton headed? As its fortunes have waned, the once high-flying maker of connected fitness bikes faces pressure from activist investors to cut costs and frenzied speculation on Wall Street that it may need to sell itself.","Rumors, restructuring and resignations loom over the former high-flying fitness company.",What Is Peloton Worth?,"Rumors, restructuring and resignations loom over the former high-flying fitness company. Where is Peloton headed? As its fortunes have waned, the once high-flying maker of connected fitness bikes faces pressure from activist investors to cut costs and frenzied speculation on Wall Street that it may need to sell itself. Rumors, restructuring and resignations loom over the former high-flying fitness company. What Is Peloton Worth? ",0.09999999999999999,0.03333333333333333
289,2022-09-23 04:40:46+00:00,Apple’s pursuit of an N.F.L. media package has broadened to include a sponsorship of one of TV’s most-watched events.,"Talks between the National Football League and Apple over a package of Sunday football games have dragged as the league and the tech giant have wrangled over pricing, but another deal has been added to the mix: sponsorship of the Super Bowl halftime show.",Apple’s pursuit of an N.F.L. media package has broadened to include a sponsorship of one of TV’s most-watched events.,Apple to Sponsor the Super Bowl Halftime Show,"Apple’s pursuit of an N.F.L. media package has broadened to include a sponsorship of one of TV’s most-watched events. Talks between the National Football League and Apple over a package of Sunday football games have dragged as the league and the tech giant have wrangled over pricing, but another deal has been added to the mix: sponsorship of the Super Bowl halftime show. Apple’s pursuit of an N.F.L. media package has broadened to include a sponsorship of one of TV’s most-watched events. Apple to Sponsor the Super Bowl Halftime Show ",0.2222222222222222,0.7777777777777777
290,2022-01-29 16:00:06+00:00,Facebook has taken steps to combat electoral interference in the U.S. It needs to do the same in other countries.,"The world is not ready for the coming electoral tsunami. Neither is Facebook. With so many elections on the horizon — France, Kenya, Australia, Brazil, the Philippines and the United States will hold elections this year — the conversation now should focus on how Facebook is preparing.",Facebook has taken steps to combat electoral interference in the U.S. It needs to do the same in other countries.,I Worked at Facebook. It’s Not Ready for This Year’s Election Wave.,"Facebook has taken steps to combat electoral interference in the U.S. It needs to do the same in other countries. The world is not ready for the coming electoral tsunami. Neither is Facebook. With so many elections on the horizon — France, Kenya, Australia, Brazil, the Philippines and the United States will hold elections this year — the conversation now should focus on how Facebook is preparing. Facebook has taken steps to combat electoral interference in the U.S. It needs to do the same in other countries. I Worked at Facebook. It’s Not Ready for This Year’s Election Wave. ",0.007142857142857145,0.35714285714285715
291,2022-08-05 16:28:39+00:00,"In just over a year, the United States’ largest cryptocurrency exchange went from a triumphant public offering to a “crypto winter” of cost cutting and layoffs.","Brian Armstrong, the chief executive of the largest cryptocurrency exchange in the United States, traveled across the world to make an announcement in early April: Coinbase was bringing crypto to India.","In just over a year, the United States’ largest cryptocurrency exchange went from a triumphant public offering to a “crypto winter” of cost cutting and layoffs.",The Humbling of Coinbase,"In just over a year, the United States’ largest cryptocurrency exchange went from a triumphant public offering to a “crypto winter” of cost cutting and layoffs. Brian Armstrong, the chief executive of the largest cryptocurrency exchange in the United States, traveled across the world to make an announcement in early April: Coinbase was bringing crypto to India. In just over a year, the United States’ largest cryptocurrency exchange went from a triumphant public offering to a “crypto winter” of cost cutting and layoffs. The Humbling of Coinbase ",-0.22000000000000003,0.44666666666666666
292,2022-06-30 16:30:55+00:00,"Eduardo Franco, who joined the Netflix hit this season, has carved out a role as the show’s addled but reliably hilarious tension-release valve.","The “Stranger Things” gang in Lenora Hills, Calif., is in danger — shots are being fired, and an agent is bleeding out. The camera switches abruptly to a view of an unknowing Argyle, played by Eduardo Franco, pulling up to the Byerses’ home as the catchy reggae hit “Pass the Dutchie” blares from his pizza delivery van.","Eduardo Franco, who joined the Netflix hit this season, has carved out a role as the show’s addled but reliably hilarious tension-release valve.","In ‘Stranger Things,’ He Delivers Pizza and Stoned Comic Relief","Eduardo Franco, who joined the Netflix hit this season, has carved out a role as the show’s addled but reliably hilarious tension-release valve. The “Stranger Things” gang in Lenora Hills, Calif., is in danger — shots are being fired, and an agent is bleeding out. The camera switches abruptly to a view of an unknowing Argyle, played by Eduardo Franco, pulling up to the Byerses’ home as the catchy reggae hit “Pass the Dutchie” blares from his pizza delivery van. Eduardo Franco, who joined the Netflix hit this season, has carved out a role as the show’s addled but reliably hilarious tension-release valve. In ‘Stranger Things,’ He Delivers Pizza and Stoned Comic Relief ",0.03194444444444446,0.8611111111111112
293,2022-07-20 10:35:32+00:00,"With the metaverse looming, a shift in designer could make a big difference.","So Jony Ive, the former Apple chief design officer and consultant, and the man most responsible for the visual allure of Apple products — the man who helped transform computers and phones into objects of desire, who made them more than mere vectors of functionality, but rather badges of identity — and his erstwhile employer have reportedly agreed to sever their last ties.","With the metaverse looming, a shift in designer could make a big difference.",Who Will Make Apple Fashionable Now?,"With the metaverse looming, a shift in designer could make a big difference. So Jony Ive, the former Apple chief design officer and consultant, and the man most responsible for the visual allure of Apple products — the man who helped transform computers and phones into objects of desire, who made them more than mere vectors of functionality, but rather badges of identity — and his erstwhile employer have reportedly agreed to sever their last ties. With the metaverse looming, a shift in designer could make a big difference. Who Will Make Apple Fashionable Now? ",0.06999999999999999,0.2416666666666667
294,2022-06-16 16:23:25+00:00,The technology is hard and the economics of mass deliveries may never make sense.,Jeff Bezos said Amazon drones would be bringing toothpaste and cat food to Americans’ homes within four or five years. That was nearly nine years ago. Oops.,The technology is hard and the economics of mass deliveries may never make sense.,Where Are the Delivery Drones?,The technology is hard and the economics of mass deliveries may never make sense. Jeff Bezos said Amazon drones would be bringing toothpaste and cat food to Americans’ homes within four or five years. That was nearly nine years ago. Oops. The technology is hard and the economics of mass deliveries may never make sense. Where Are the Delivery Drones? ,-0.16111111111111112,0.49444444444444446
