,pub_date,abstract,lead_paragraph,snippet,headline.main,text,polarity,subjectivity
165,2022-01-10 10:00:08+00:00,"Xbox head Phil Spencer discusses how the gaming industry is already peeking into the metaverse with avatars, virtual worlds and online economies.","When it comes to the metaverse, Phil Spencer could give Mark Zuckerberg a run for his money. The head of Xbox and executive vice president of gaming at Microsoft, Spencer says popular games like Microsoft’s Halo and Minecraft — and competitors like Roblox and Fortnite — are already creating virtual worlds similar to the metaverse. And he says that video games, whose sales have soared during Covid, could offer lessons for the workplaces that have moved online in the pandemic: “We look at these virtual spaces, and some of the things that we’ve learned in video games of people coming together to cooperate together, to achieve tasks.”","Xbox head Phil Spencer discusses how the gaming industry is already peeking into the metaverse with avatars, virtual worlds and online economies.","To Understand the Metaverse, Look to Video Games","Xbox head Phil Spencer discusses how the gaming industry is already peeking into the metaverse with avatars, virtual worlds and online economies. When it comes to the metaverse, Phil Spencer could give Mark Zuckerberg a run for his money. The head of Xbox and executive vice president of gaming at Microsoft, Spencer says popular games like Microsoft’s Halo and Minecraft — and competitors like Roblox and Fortnite — are already creating virtual worlds similar to the metaverse. And he says that video games, whose sales have soared during Covid, could offer lessons for the workplaces that have moved online in the pandemic: “We look at these virtual spaces, and some of the things that we’ve learned in video games of people coming together to cooperate together, to achieve tasks.” Xbox head Phil Spencer discusses how the gaming industry is already peeking into the metaverse with avatars, virtual worlds and online economies. To Understand the Metaverse, Look to Video Games ",0.3,0.65
166,2022-01-03 10:00:06+00:00,Dick Costolo discusses the unique difficulties of heading the social media platform.,"Remember social media before Donald Trump’s presidency? Dick Costolo does. He was Twitter’s chief executive from 2010 to 2015. And despite being in the hot seat for certain content moderation decisions during his tenure, Costolo thinks that platforms have the right to take down whatever and whomever they want. He argues that the key is transparency and companies acknowledging that every decision “ends up being subjective anyway” — so that no one is surprised “when we decide to treat the avatar who signed up on a Tuesday with zero followers differently than we treat The New York Times.”",Dick Costolo discusses the unique difficulties of heading the social media platform.,"Twitter’s Former C.E.O. Has a ‘Too Bad, So Sad’ Approach to Content Moderation","Dick Costolo discusses the unique difficulties of heading the social media platform. Remember social media before Donald Trump’s presidency? Dick Costolo does. He was Twitter’s chief executive from 2010 to 2015. And despite being in the hot seat for certain content moderation decisions during his tenure, Costolo thinks that platforms have the right to take down whatever and whomever they want. He argues that the key is transparency and companies acknowledging that every decision “ends up being subjective anyway” — so that no one is surprised “when we decide to treat the avatar who signed up on a Tuesday with zero followers differently than we treat The New York Times.” Dick Costolo discusses the unique difficulties of heading the social media platform. Twitter’s Former C.E.O. Has a ‘Too Bad, So Sad’ Approach to Content Moderation ",0.030050505050505057,0.5667027417027416
167,2022-04-27 20:57:47+00:00,"It was the company’s second consecutive quarterly decline, the first time that had happened in over a decade.","Mark Zuckerberg, the founder of Facebook, has staked his company’s future on an immersive online world known as the metaverse. On Wednesday, the company showed it was still navigating that transformation.","It was the company’s second consecutive quarterly decline, the first time that had happened in over a decade.","Meta, Facebook’s parent, reports a 21 percent drop in profits.","It was the company’s second consecutive quarterly decline, the first time that had happened in over a decade. Mark Zuckerberg, the founder of Facebook, has staked his company’s future on an immersive online world known as the metaverse. On Wednesday, the company showed it was still navigating that transformation. It was the company’s second consecutive quarterly decline, the first time that had happened in over a decade. Meta, Facebook’s parent, reports a 21 percent drop in profits. ",0.1,0.15833333333333333
168,2022-08-24 22:30:36+00:00,"Last month, the company said it planned to acquire One Medical, a much larger competitor to its own health care business.","Amazon told employees in an email on Wednesday that it is shutting down Amazon Care, its in-house foray into providing primary and urgent health care. The move comes a month after Amazon announced plans to buy a much larger competitor, One Medical, in a $3.9 billion deal.","Last month, the company said it planned to acquire One Medical, a much larger competitor to its own health care business.","Amazon says it will shut down Amazon Care, its primary and urgent health care business.","Last month, the company said it planned to acquire One Medical, a much larger competitor to its own health care business. Amazon told employees in an email on Wednesday that it is shutting down Amazon Care, its in-house foray into providing primary and urgent health care. The move comes a month after Amazon announced plans to buy a much larger competitor, One Medical, in a $3.9 billion deal. Last month, the company said it planned to acquire One Medical, a much larger competitor to its own health care business. Amazon says it will shut down Amazon Care, its primary and urgent health care business. ",0.12063492063492062,0.37222222222222223
169,2022-08-16 13:01:06+00:00,The company joins several others that are introducing self-driving services — but the cars often have drivers or are otherwise limited in their autonomy.,Self-driving car services are popping up across the country. But they are not what they seem.,The company joins several others that are introducing self-driving services — but the cars often have drivers or are otherwise limited in their autonomy.,Lyft Unveils Self-Driving Car Service in Las Vegas (With Caveats),The company joins several others that are introducing self-driving services — but the cars often have drivers or are otherwise limited in their autonomy. Self-driving car services are popping up across the country. But they are not what they seem. The company joins several others that are introducing self-driving services — but the cars often have drivers or are otherwise limited in their autonomy. Lyft Unveils Self-Driving Car Service in Las Vegas (With Caveats) ,-0.03571428571428571,0.07142857142857142
170,2022-07-13 20:11:22+00:00,"The streaming giant hopes a less expensive offering will boost subscription numbers, which have dropped for the first time in a decade.","Netflix has selected Microsoft to help build its forthcoming ad-supported tier, the streaming giant said on Wednesday.","The streaming giant hopes a less expensive offering will boost subscription numbers, which have dropped for the first time in a decade.",Netflix turns to Microsoft to help build its new ad-supported service.,"The streaming giant hopes a less expensive offering will boost subscription numbers, which have dropped for the first time in a decade. Netflix has selected Microsoft to help build its forthcoming ad-supported tier, the streaming giant said on Wednesday. The streaming giant hopes a less expensive offering will boost subscription numbers, which have dropped for the first time in a decade. Netflix turns to Microsoft to help build its new ad-supported service. ",-0.06969696969696969,0.5654545454545453
171,2022-05-26 11:12:58+00:00,The resulting combination of chip company and software maker would be one of the most important suppliers of technology to the cloud computing market.,"Broadcom, the semiconductor giant, said on Thursday that it had agreed to buy the software company VMware in a transaction valued at $61 billion that would reshuffle the vast market for enterprise computing technology.",The resulting combination of chip company and software maker would be one of the most important suppliers of technology to the cloud computing market.,Broadcom to Acquire VMware in $61 Billion Enterprise Computing Deal,"The resulting combination of chip company and software maker would be one of the most important suppliers of technology to the cloud computing market. Broadcom, the semiconductor giant, said on Thursday that it had agreed to buy the software company VMware in a transaction valued at $61 billion that would reshuffle the vast market for enterprise computing technology. The resulting combination of chip company and software maker would be one of the most important suppliers of technology to the cloud computing market. Broadcom to Acquire VMware in $61 Billion Enterprise Computing Deal ",0.3,0.8333333333333334
172,2022-06-07 16:21:27+00:00,What do Google Glass and Pokémon Go have in common? They didn’t change the world.,"In 2013, Apple’s chief executive, Tim Cook, said that gadgets we wear on our wrists “could be a profound area of technology.”",What do Google Glass and Pokémon Go have in common? They didn’t change the world.,A Short History of Tech Predictions,"What do Google Glass and Pokémon Go have in common? They didn’t change the world. In 2013, Apple’s chief executive, Tim Cook, said that gadgets we wear on our wrists “could be a profound area of technology.” What do Google Glass and Pokémon Go have in common? They didn’t change the world. A Short History of Tech Predictions ",-0.12916666666666665,0.575
173,2022-07-21 13:46:44+00:00,"The $3.9 billion deal is Amazon’s latest acquisition in the health care industry. In 2018, it acquired PillPack, an online pharmacy.","SEATTLE — Just two months ago, Andy Jassy, almost a year into his reign as Amazon’s chief executive, told investors that driving down costs was a “really big area of focus,” after the company produced its worst quarterly earnings in years. But that didn’t mean he wasn’t open to a deal.","The $3.9 billion deal is Amazon’s latest acquisition in the health care industry. In 2018, it acquired PillPack, an online pharmacy.",Amazon to acquire One Medical clinics in latest push into health care.,"The $3.9 billion deal is Amazon’s latest acquisition in the health care industry. In 2018, it acquired PillPack, an online pharmacy. SEATTLE — Just two months ago, Andy Jassy, almost a year into his reign as Amazon’s chief executive, told investors that driving down costs was a “really big area of focus,” after the company produced its worst quarterly earnings in years. But that didn’t mean he wasn’t open to a deal. The $3.9 billion deal is Amazon’s latest acquisition in the health care industry. In 2018, it acquired PillPack, an online pharmacy. Amazon to acquire One Medical clinics in latest push into health care. ",0.0035493827160493823,0.5862654320987655
174,2022-01-20 17:21:46+00:00,"The company plans to open Amazon Style later this year in Glendale, Calif., that will incorporate customers’ physical browsing behavior and preferences on the Amazon Shopping app.","Amazon, which has posed formidable challenges to booksellers, big-box chains and grocers, has a new kind of retailer in its sights: physical clothing stores.","The company plans to open Amazon Style later this year in Glendale, Calif., that will incorporate customers’ physical browsing behavior and preferences on the Amazon Shopping app.",Amazon plans a new rival for retailers: a physical clothing store.,"The company plans to open Amazon Style later this year in Glendale, Calif., that will incorporate customers’ physical browsing behavior and preferences on the Amazon Shopping app. Amazon, which has posed formidable challenges to booksellers, big-box chains and grocers, has a new kind of retailer in its sights: physical clothing stores. The company plans to open Amazon Style later this year in Glendale, Calif., that will incorporate customers’ physical browsing behavior and preferences on the Amazon Shopping app. Amazon plans a new rival for retailers: a physical clothing store. ",0.0793388429752066,0.3073199527744982
175,2022-02-10 12:00:07+00:00,"A look back at a time when “excellence in broadcasting” was taken seriously, including interviews with Joan Jett, Jon Bon Jovi and other stars.","It wasn’t long ago that a subset of media enthusiasts took the concept of “excellence in broadcasting” seriously. It was enough of a thing with Rush Limbaugh and his fans that there was a 2010 episode of “Family Guy” sending it up — with Limbaugh’s own participation, even. While the phrase never actually comes up in “Worst to First: The True Story of Z100 New York,” the movie feels inspired by the concept.","A look back at a time when “excellence in broadcasting” was taken seriously, including interviews with Joan Jett, Jon Bon Jovi and other stars.",‘Worst to First: The True Story of Z100 New York’ Review: An FM Radio Sensation,"A look back at a time when “excellence in broadcasting” was taken seriously, including interviews with Joan Jett, Jon Bon Jovi and other stars. It wasn’t long ago that a subset of media enthusiasts took the concept of “excellence in broadcasting” seriously. It was enough of a thing with Rush Limbaugh and his fans that there was a 2010 episode of “Family Guy” sending it up — with Limbaugh’s own participation, even. While the phrase never actually comes up in “Worst to First: The True Story of Z100 New York,” the movie feels inspired by the concept. A look back at a time when “excellence in broadcasting” was taken seriously, including interviews with Joan Jett, Jon Bon Jovi and other stars. ‘Worst to First: The True Story of Z100 New York’ Review: An FM Radio Sensation ",-0.06459330143540672,0.5066188197767145
176,2022-01-25 21:25:31+00:00,"Before the end of the year, ispace aims to place a lander with two small rovers on the lunar surface. It may find other visitors have also made the trip this year.","A Japanese company is pushing ahead with plans to launch a private moon lander by the end of 2022, a year packed with other moonshot ambitions and rehearsals that could foretell how soon humans get back to the lunar surface.","Before the end of the year, ispace aims to place a lander with two small rovers on the lunar surface. It may find other visitors have also made the trip this year.",Japanese Company Joins March Back to the Moon in 2022,"Before the end of the year, ispace aims to place a lander with two small rovers on the lunar surface. It may find other visitors have also made the trip this year. A Japanese company is pushing ahead with plans to launch a private moon lander by the end of 2022, a year packed with other moonshot ambitions and rehearsals that could foretell how soon humans get back to the lunar surface. Before the end of the year, ispace aims to place a lander with two small rovers on the lunar surface. It may find other visitors have also made the trip this year. Japanese Company Joins March Back to the Moon in 2022 ",-0.0875,0.22999999999999998
177,2022-01-11 20:54:03+00:00,The government can proceed with its claims that the company abused its monopoly power through acquisitions.,"A federal judge on Tuesday allowed the Federal Trade Commission’s antitrust lawsuit against Facebook to move forward, rejecting Facebook’s request to dismiss the case and handing the agency a major victory in its quest to curtail the power of the biggest tech companies.",The government can proceed with its claims that the company abused its monopoly power through acquisitions.,"A Facebook antitrust suit can move forward, a judge says, in a win for the F.T.C.","The government can proceed with its claims that the company abused its monopoly power through acquisitions. A federal judge on Tuesday allowed the Federal Trade Commission’s antitrust lawsuit against Facebook to move forward, rejecting Facebook’s request to dismiss the case and handing the agency a major victory in its quest to curtail the power of the biggest tech companies. The government can proceed with its claims that the company abused its monopoly power through acquisitions. A Facebook antitrust suit can move forward, a judge says, in a win for the F.T.C. ",0.43125,0.45
178,2022-08-25 17:56:26+00:00,"The dream was to sell directly to customers. Now Peloton is on Amazon, Casper is in a furniture shop, and it’s awkward.","Earlier this summer, I bought an online mattress — in a boring, conventional store.","The dream was to sell directly to customers. Now Peloton is on Amazon, Casper is in a furniture shop, and it’s awkward.",Why Peloton Is Selling on Amazon,"The dream was to sell directly to customers. Now Peloton is on Amazon, Casper is in a furniture shop, and it’s awkward. Earlier this summer, I bought an online mattress — in a boring, conventional store. The dream was to sell directly to customers. Now Peloton is on Amazon, Casper is in a furniture shop, and it’s awkward. Why Peloton Is Selling on Amazon ",-0.30612244897959184,0.6653061224489795
179,2022-08-31 11:54:11+00:00,The retailer confirmed that it has taken out more than $500 million in new financing as it seeks to shore up its struggling business.,"Bed Bath & Beyond confirmed today that it has taken out more than $500 million in new financing, including a $375 million loan from Sixth Street, sorely needed cash to help drive the retailer’s turnaround. Its fall from grace has been spectacular: The company was worth around $17 billion in 2013; today, it’s worth less than $1 billion, with roughly $100 million in cash. (Its shares dropped more than 26 percent in premarket trading this morning after the company disclosed plans to issue new stock, seeking to take advantage of a meme-stock frenzy.) This isn’t its first attempt at a turnaround.",The retailer confirmed that it has taken out more than $500 million in new financing as it seeks to shore up its struggling business.,Bed Bath & Beyond Secures a Financial Lifeline,"The retailer confirmed that it has taken out more than $500 million in new financing as it seeks to shore up its struggling business. Bed Bath & Beyond confirmed today that it has taken out more than $500 million in new financing, including a $375 million loan from Sixth Street, sorely needed cash to help drive the retailer’s turnaround. Its fall from grace has been spectacular: The company was worth around $17 billion in 2013; today, it’s worth less than $1 billion, with roughly $100 million in cash. (Its shares dropped more than 26 percent in premarket trading this morning after the company disclosed plans to issue new stock, seeking to take advantage of a meme-stock frenzy.) This isn’t its first attempt at a turnaround. The retailer confirmed that it has taken out more than $500 million in new financing as it seeks to shore up its struggling business. Bed Bath & Beyond Secures a Financial Lifeline ",0.2738215488215488,0.4843434343434343
180,2022-07-05 23:21:37+00:00,Questions are surfacing once again about whether TikTok poses a national security threat because it is owned by a Chinese company.,"The leaders of the Senate Intelligence Committee asked the Federal Trade Commission on Tuesday to investigate whether TikTok, the Chinese-owned video app, had misled the public about whether Beijing could have access to American user data.",Questions are surfacing once again about whether TikTok poses a national security threat because it is owned by a Chinese company.,Lawmakers ask F.T.C. chair to investigate TikTok’s data practices.,"Questions are surfacing once again about whether TikTok poses a national security threat because it is owned by a Chinese company. The leaders of the Senate Intelligence Committee asked the Federal Trade Commission on Tuesday to investigate whether TikTok, the Chinese-owned video app, had misled the public about whether Beijing could have access to American user data. Questions are surfacing once again about whether TikTok poses a national security threat because it is owned by a Chinese company. Lawmakers ask F.T.C. chair to investigate TikTok’s data practices. ",0.0,0.016666666666666666
181,2022-05-23 23:23:26+00:00,"Snap’s announcement comes amid a slowdown for tech start-ups, as venture capital funding has fallen and young companies have been cutting costs and laying off employees.","Snap, the maker of the messaging app Snapchat, said on Monday that it expected to miss its quarterly financial goals as it dealt with toughening economic conditions.","Snap’s announcement comes amid a slowdown for tech start-ups, as venture capital funding has fallen and young companies have been cutting costs and laying off employees.",Snap warns it will miss earnings goals because of economic challenges.,"Snap’s announcement comes amid a slowdown for tech start-ups, as venture capital funding has fallen and young companies have been cutting costs and laying off employees. Snap, the maker of the messaging app Snapchat, said on Monday that it expected to miss its quarterly financial goals as it dealt with toughening economic conditions. Snap’s announcement comes amid a slowdown for tech start-ups, as venture capital funding has fallen and young companies have been cutting costs and laying off employees. Snap warns it will miss earnings goals because of economic challenges. ",-0.0875,0.42500000000000004
182,2022-02-24 17:41:57+00:00,"Shoving these videos at us is a little bit sad, a little bit brilliant — and very much worth watching.",This article is part of the On Tech newsletter. Here is a collection of past columns.,"Shoving these videos at us is a little bit sad, a little bit brilliant — and very much worth watching.",Facebook Will Make You Love Reels,"Shoving these videos at us is a little bit sad, a little bit brilliant — and very much worth watching. This article is part of the On Tech newsletter. Here is a collection of past columns. Shoving these videos at us is a little bit sad, a little bit brilliant — and very much worth watching. Facebook Will Make You Love Reels ",0.075,0.5874999999999999
183,2022-08-02 17:22:32+00:00,The U.S. wants to stop Penguin Random House from buying Simon & Schuster. The elephant in the room is Amazon.,Amazon isn’t on trial in a big books lawsuit. But its power is.,The U.S. wants to stop Penguin Random House from buying Simon & Schuster. The elephant in the room is Amazon.,The Books Merger That’s About Amazon,The U.S. wants to stop Penguin Random House from buying Simon & Schuster. The elephant in the room is Amazon. Amazon isn’t on trial in a big books lawsuit. But its power is. The U.S. wants to stop Penguin Random House from buying Simon & Schuster. The elephant in the room is Amazon. The Books Merger That’s About Amazon ,-0.12,0.25999999999999995
184,2022-07-28 12:34:01+00:00,"Chair Jerome Powell was asked in every way possible whether the economy was in, or headed toward, a recession.","The Federal Reserve is continuing its aggressive campaign to cool inflation, even as the economy begins to slow. The U.S. central bank raised interest rates yesterday — this time by three-quarters of a percentage point — for the fourth time this year. Investors cheered the move, with the S&P 500 rising nearly 3 percent by the end of the day. Futures markets suggest stocks will open slightly lower today. The Fed’s benchmark short-term interest rate is now as high as 2.5 percent, up from near-zero in March.","Chair Jerome Powell was asked in every way possible whether the economy was in, or headed toward, a recession.",The Fed Won’t Say the ‘R’ Word,"Chair Jerome Powell was asked in every way possible whether the economy was in, or headed toward, a recession. The Federal Reserve is continuing its aggressive campaign to cool inflation, even as the economy begins to slow. The U.S. central bank raised interest rates yesterday — this time by three-quarters of a percentage point — for the fourth time this year. Investors cheered the move, with the S&P 500 rising nearly 3 percent by the end of the day. Futures markets suggest stocks will open slightly lower today. The Fed’s benchmark short-term interest rate is now as high as 2.5 percent, up from near-zero in March. Chair Jerome Powell was asked in every way possible whether the economy was in, or headed toward, a recession. The Fed Won’t Say the ‘R’ Word ",0.014333333333333328,0.49066666666666664
