,pub_date,abstract,lead_paragraph,snippet,headline.main,text,polarity,subjectivity
85,2022-02-23 10:00:19+00:00,The embrace by some conservative influencers and conspiracy theorists is part of a broader effort to shift people away from Big Tech.,"To hear more audio stories from publications like The New York Times, download Audm for iPhone or Android.",The embrace by some conservative influencers and conspiracy theorists is part of a broader effort to shift people away from Big Tech.,"Fed Up With Google, Conspiracy Theorists Turn to DuckDuckGo","The embrace by some conservative influencers and conspiracy theorists is part of a broader effort to shift people away from Big Tech. To hear more audio stories from publications like The New York Times, download Audm for iPhone or Android. The embrace by some conservative influencers and conspiracy theorists is part of a broader effort to shift people away from Big Tech. Fed Up With Google, Conspiracy Theorists Turn to DuckDuckGo ",0.1590909090909091,0.28863636363636364
86,2022-01-14 17:43:48+00:00,The states argue that Google reached a deal with Facebook to have the social network join its effort in an effort to “kill” a competing ad network.,"Google’s chief executive approved an agreement with Facebook at the heart of an antitrust lawsuit that 16 states and Puerto Rico have lodged against the search giant, according to a portion of the complaint revealed on Friday.",The states argue that Google reached a deal with Facebook to have the social network join its effort in an effort to “kill” a competing ad network.,"Google’s chief executive signed off on deal at center of antitrust case, states say.","The states argue that Google reached a deal with Facebook to have the social network join its effort in an effort to “kill” a competing ad network. Google’s chief executive approved an agreement with Facebook at the heart of an antitrust lawsuit that 16 states and Puerto Rico have lodged against the search giant, according to a portion of the complaint revealed on Friday. The states argue that Google reached a deal with Facebook to have the social network join its effort in an effort to “kill” a competing ad network. Google’s chief executive signed off on deal at center of antitrust case, states say. ",-0.06666666666666668,0.2866666666666667
87,2022-01-14 11:06:35+00:00,"The internet giant, planning on employees returning to the office for a few days a week, is building another $1 billion office less than two miles away.","Google said Friday that it would spend $1 billion to purchase a London office building, making it the owner of another high-priced piece of real estate as the internet giant bets on an eventual return to office for its employees around the world.","The internet giant, planning on employees returning to the office for a few days a week, is building another $1 billion office less than two miles away.",Google pays $1 billion for a London office building.,"The internet giant, planning on employees returning to the office for a few days a week, is building another $1 billion office less than two miles away. Google said Friday that it would spend $1 billion to purchase a London office building, making it the owner of another high-priced piece of real estate as the internet giant bets on an eventual return to office for its employees around the world. The internet giant, planning on employees returning to the office for a few days a week, is building another $1 billion office less than two miles away. Google pays $1 billion for a London office building. ",-0.06666666666666667,0.4541666666666667
88,2022-01-24 16:43:14+00:00,Three states and the District of Columbia allege that the tech giant misled consumers by continuing to track those who had changed their privacy settings to prevent data collection.,"The District of Columbia and three states sued Google on Monday, claiming that the tech giant deceived consumers to gain access to their location data.",Three states and the District of Columbia allege that the tech giant misled consumers by continuing to track those who had changed their privacy settings to prevent data collection.,Four Attorneys General Claim Google Secretly Tracked People,"Three states and the District of Columbia allege that the tech giant misled consumers by continuing to track those who had changed their privacy settings to prevent data collection. The District of Columbia and three states sued Google on Monday, claiming that the tech giant deceived consumers to gain access to their location data. Three states and the District of Columbia allege that the tech giant misled consumers by continuing to track those who had changed their privacy settings to prevent data collection. Four Attorneys General Claim Google Secretly Tracked People ",-0.06999999999999999,0.8400000000000001
89,2022-03-12 08:00:09+00:00,"Mykhailo Fedorov, Ukraine’s youngest minister, has turned technology, cryptocurrency and social media into modern weapons of war.","After war began last month, President Volodymyr Zelensky of Ukraine turned to Mykhailo Fedorov, a vice prime minister, for a key role.","Mykhailo Fedorov, Ukraine’s youngest minister, has turned technology, cryptocurrency and social media into modern weapons of war.","Shaming Apple and Texting Musk, a Ukraine Minister Uses Novel War Tactics","Mykhailo Fedorov, Ukraine’s youngest minister, has turned technology, cryptocurrency and social media into modern weapons of war. After war began last month, President Volodymyr Zelensky of Ukraine turned to Mykhailo Fedorov, a vice prime minister, for a key role. Mykhailo Fedorov, Ukraine’s youngest minister, has turned technology, cryptocurrency and social media into modern weapons of war. Shaming Apple and Texting Musk, a Ukraine Minister Uses Novel War Tactics ",0.07777777777777778,0.3
90,2022-02-02 10:03:13+00:00,A small search engine company in the Czech Republic helped inspire a law that is poised to put major limits on tech giants like Google.,"As Google extended its dominance as a search engine over the past two decades, the Czech Republic stood out as a surprising holdout.",A small search engine company in the Czech Republic helped inspire a law that is poised to put major limits on tech giants like Google.,Google Vanquished a Rival in Prague. Payback Could Hurt.,"A small search engine company in the Czech Republic helped inspire a law that is poised to put major limits on tech giants like Google. As Google extended its dominance as a search engine over the past two decades, the Czech Republic stood out as a surprising holdout. A small search engine company in the Czech Republic helped inspire a law that is poised to put major limits on tech giants like Google. Google Vanquished a Rival in Prague. Payback Could Hurt. ",0.012499999999999992,0.425
91,2022-01-10 15:00:05+00:00,"The latest tranche totals about 200. They are among more than 1,000 that the company, accused of firing union organizers, claimed were protected by attorney-client privilege.","Google wrongly claimed attorney-client privilege to protect documents subpoenaed in a National Labor Relations Board case filed by former employees who say the company fired them because of their unionization efforts, a labor judge has ruled.","The latest tranche totals about 200. They are among more than 1,000 that the company, accused of firing union organizers, claimed were protected by attorney-client privilege.","Google must turn over more documents in a labor case, a judge rules.","The latest tranche totals about 200. They are among more than 1,000 that the company, accused of firing union organizers, claimed were protected by attorney-client privilege. Google wrongly claimed attorney-client privilege to protect documents subpoenaed in a National Labor Relations Board case filed by former employees who say the company fired them because of their unionization efforts, a labor judge has ruled. The latest tranche totals about 200. They are among more than 1,000 that the company, accused of firing union organizers, claimed were protected by attorney-client privilege. Google must turn over more documents in a labor case, a judge rules. ",0.2857142857142857,0.5999999999999999
92,2022-01-25 13:00:09+00:00,The company is scrapping another plan that would have blocked so-called cookies after privacy groups and regulators complained that Google needed to do more to ensure privacy.,"When Google announced a plan to block digital tracking cookies from its Chrome web browser two years ago, the advertising industry and regulators worried that the proposal would further entrench the search giant’s dominance over online ads.",The company is scrapping another plan that would have blocked so-called cookies after privacy groups and regulators complained that Google needed to do more to ensure privacy.,Google introduces a new system for tracking Chrome browser users.,"The company is scrapping another plan that would have blocked so-called cookies after privacy groups and regulators complained that Google needed to do more to ensure privacy. When Google announced a plan to block digital tracking cookies from its Chrome web browser two years ago, the advertising industry and regulators worried that the proposal would further entrench the search giant’s dominance over online ads. The company is scrapping another plan that would have blocked so-called cookies after privacy groups and regulators complained that Google needed to do more to ensure privacy. Google introduces a new system for tracking Chrome browser users. ",0.06704545454545455,0.41931818181818187
93,2022-03-02 12:00:06+00:00,"The company, which is owned by Google, received at least 174 reports of the battery in its Ionic smart watch overheating, leading to 118 reported injuries.","Fitbit, the Google-owned maker of health tracking wearables, is voluntarily recalling its Ionic smart watch after more than 100 reports of burn injuries caused by an overheating battery, the Consumer Product Safety Commission said on Wednesday.","The company, which is owned by Google, received at least 174 reports of the battery in its Ionic smart watch overheating, leading to 118 reported injuries.",Fitbit recalls more than one million smart watches over a burn risk.,"The company, which is owned by Google, received at least 174 reports of the battery in its Ionic smart watch overheating, leading to 118 reported injuries. Fitbit, the Google-owned maker of health tracking wearables, is voluntarily recalling its Ionic smart watch after more than 100 reports of burn injuries caused by an overheating battery, the Consumer Product Safety Commission said on Wednesday. The company, which is owned by Google, received at least 174 reports of the battery in its Ionic smart watch overheating, leading to 118 reported injuries. Fitbit recalls more than one million smart watches over a burn risk. ",0.1571428571428571,0.5464285714285715
94,2022-01-06 22:25:32+00:00,"The company will not be allowed to import products that infringe on Sonos patents, including smart speakers, video streaming devices, and some computers and phones.","OAKLAND, Calif. — Google infringed on five audio technology patents held by the speaker manufacturer Sonos and is not allowed to import products that violate Sonos’s intellectual property into the United States, a trade court ruled on Thursday.","The company will not be allowed to import products that infringe on Sonos patents, including smart speakers, video streaming devices, and some computers and phones.","Google Infringed on Sonos Speaker Technology, Trade Court Rules","The company will not be allowed to import products that infringe on Sonos patents, including smart speakers, video streaming devices, and some computers and phones. OAKLAND, Calif. — Google infringed on five audio technology patents held by the speaker manufacturer Sonos and is not allowed to import products that violate Sonos’s intellectual property into the United States, a trade court ruled on Thursday. The company will not be allowed to import products that infringe on Sonos patents, including smart speakers, video streaming devices, and some computers and phones. Google Infringed on Sonos Speaker Technology, Trade Court Rules ",0.24285714285714285,0.561904761904762
95,2022-03-04 19:39:18+00:00,"Facebook on Friday became the first American tech giant to be blocked by the Russian government, as part of the Kremlin’s broadening campaign to tighten control of the internet and limit spaces for dissent about the war in Ukraine.","Facebook on Friday became the first American tech giant to be blocked by the Russian government, as part of the Kremlin’s broadening campaign to tighten control of the internet and limit spaces for dissent about the war in Ukraine.",,"Russia blocks Facebook inside the country, as the Kremlin moves to stifle dissent.","Facebook on Friday became the first American tech giant to be blocked by the Russian government, as part of the Kremlin’s broadening campaign to tighten control of the internet and limit spaces for dissent about the war in Ukraine. Facebook on Friday became the first American tech giant to be blocked by the Russian government, as part of the Kremlin’s broadening campaign to tighten control of the internet and limit spaces for dissent about the war in Ukraine.  Russia blocks Facebook inside the country, as the Kremlin moves to stifle dissent. ",0.0625,0.3333333333333333
96,2022-02-28 22:39:17+00:00,"Google, Meta, Twitter, Telegram and others are levers in the conflict, caught between demands from Ukraine, Russia, the European Union and the U.S.","Russia’s invasion of Ukraine has become a defining geopolitical moment for some of the world’s biggest tech companies, as their platforms have turned into major battlefields for a parallel information war and their data and services have become vital links in the conflict.","Google, Meta, Twitter, Telegram and others are levers in the conflict, caught between demands from Ukraine, Russia, the European Union and the U.S.",Ukraine War Tests the Power of Tech Giants,"Google, Meta, Twitter, Telegram and others are levers in the conflict, caught between demands from Ukraine, Russia, the European Union and the U.S. Russia’s invasion of Ukraine has become a defining geopolitical moment for some of the world’s biggest tech companies, as their platforms have turned into major battlefields for a parallel information war and their data and services have become vital links in the conflict. Google, Meta, Twitter, Telegram and others are levers in the conflict, caught between demands from Ukraine, Russia, the European Union and the U.S. Ukraine War Tests the Power of Tech Giants ",0.0325,0.18
97,2022-03-09 15:32:05+00:00,"Under pressure from investors and consumers, many Western companies are unwinding their investments, closing stores and pausing sales in Russia.","After the Russian president, Vladimir V. Putin, ordered the invasion of Ukraine on Feb. 24, multinational companies have been forced to re-examine their ties with Russia. Some, like McDonald’s, PepsiCo and Shell, had built relationships with the country over decades and were faced with untangling complicated deals.","Under pressure from investors and consumers, many Western companies are unwinding their investments, closing stores and pausing sales in Russia.","Companies Are Getting Out of Russia, Sometimes at a Cost","Under pressure from investors and consumers, many Western companies are unwinding their investments, closing stores and pausing sales in Russia. After the Russian president, Vladimir V. Putin, ordered the invasion of Ukraine on Feb. 24, multinational companies have been forced to re-examine their ties with Russia. Some, like McDonald’s, PepsiCo and Shell, had built relationships with the country over decades and were faced with untangling complicated deals. Under pressure from investors and consumers, many Western companies are unwinding their investments, closing stores and pausing sales in Russia. Companies Are Getting Out of Russia, Sometimes at a Cost ",0.028571428571428564,0.31428571428571433
98,2022-03-05 08:02:25+00:00,Russia’s attack may have you wondering what will happen if the conflict spills into cyberthreats beyond Ukraine’s borders. Here’s what you can do to ease your mind.,What if the lights go out? Or A.T.M. networks go down? Or digital giants like Google that I trust with vital information come under attack?,Russia’s attack may have you wondering what will happen if the conflict spills into cyberthreats beyond Ukraine’s borders. Here’s what you can do to ease your mind.,A Paranoid Person’s Guide to Preparing for Digital Danger,Russia’s attack may have you wondering what will happen if the conflict spills into cyberthreats beyond Ukraine’s borders. Here’s what you can do to ease your mind. What if the lights go out? Or A.T.M. networks go down? Or digital giants like Google that I trust with vital information come under attack? Russia’s attack may have you wondering what will happen if the conflict spills into cyberthreats beyond Ukraine’s borders. Here’s what you can do to ease your mind. A Paranoid Person’s Guide to Preparing for Digital Danger ,-0.013888888888888895,0.17222222222222222
99,2022-02-26 10:00:22+00:00,"Google, Apple and others were warned that they must comply with a new law, which would make them more vulnerable to the Kremlin’s censorship demands.","As Russia attacks Ukraine, the authorities in Moscow are intensifying a censorship campaign at home by squeezing some of the world’s biggest tech companies.","Google, Apple and others were warned that they must comply with a new law, which would make them more vulnerable to the Kremlin’s censorship demands.","Russia Intensifies Censorship Campaign, Pressuring Tech Giants","Google, Apple and others were warned that they must comply with a new law, which would make them more vulnerable to the Kremlin’s censorship demands. As Russia attacks Ukraine, the authorities in Moscow are intensifying a censorship campaign at home by squeezing some of the world’s biggest tech companies. Google, Apple and others were warned that they must comply with a new law, which would make them more vulnerable to the Kremlin’s censorship demands. Russia Intensifies Censorship Campaign, Pressuring Tech Giants ",0.04545454545454545,0.48484848484848486
100,2022-02-20 12:00:06+00:00,Americans kept shopping last month. China’s sunny version of the Olympics. And the potential impact on energy markets of a  Ukraine invasion.,"Google announced on Wednesday that it planned to change its Android smartphone software to limit the sharing of data across apps and with third parties. The other major smartphone software provider, Apple, which has made privacy a selling point, announced new measures last year. But the two companies have taken different approaches. Apple allows customers to choose whether to block tracking, which has had a significant impact on companies that rely on customer data to target ads. Meta said this month that the changes would cost it $10 billion in ad revenue this year. Google, which unlike Apple makes most of its money from selling digital ads rather than devices, promised that its changes would not be as disruptive. It plans to support its existing technologies for at least two more years to give advertisers a chance to prepare.",Americans kept shopping last month. China’s sunny version of the Olympics. And the potential impact on energy markets of a  Ukraine invasion.,The Week in Business: A Step Toward Data Privacy,"Americans kept shopping last month. China’s sunny version of the Olympics. And the potential impact on energy markets of a  Ukraine invasion. Google announced on Wednesday that it planned to change its Android smartphone software to limit the sharing of data across apps and with third parties. The other major smartphone software provider, Apple, which has made privacy a selling point, announced new measures last year. But the two companies have taken different approaches. Apple allows customers to choose whether to block tracking, which has had a significant impact on companies that rely on customer data to target ads. Meta said this month that the changes would cost it $10 billion in ad revenue this year. Google, which unlike Apple makes most of its money from selling digital ads rather than devices, promised that its changes would not be as disruptive. It plans to support its existing technologies for at least two more years to give advertisers a chance to prepare. Americans kept shopping last month. China’s sunny version of the Olympics. And the potential impact on energy markets of a  Ukraine invasion. The Week in Business: A Step Toward Data Privacy ",0.0765909090909091,0.42696969696969694
101,2022-02-22 08:00:11+00:00,"Even as they allow some employees to change how often they come into the office, tech companies are rapidly buying and leasing properties around the country.","TEMPE, Ariz. — Early in the pandemic, when shops along Mill Avenue in downtown Tempe closed their doors and students at nearby Arizona State University were asked to go home, the roar of construction continued to fill the air. Now, gleaming in the sunlight and stuffed with amenities, towering glass office buildings have sprouted up all over the Phoenix metropolitan area.","Even as they allow some employees to change how often they come into the office, tech companies are rapidly buying and leasing properties around the country.",Big Tech Makes a Big Bet: Offices Are Still the Future,"Even as they allow some employees to change how often they come into the office, tech companies are rapidly buying and leasing properties around the country. TEMPE, Ariz. — Early in the pandemic, when shops along Mill Avenue in downtown Tempe closed their doors and students at nearby Arizona State University were asked to go home, the roar of construction continued to fill the air. Now, gleaming in the sunlight and stuffed with amenities, towering glass office buildings have sprouted up all over the Phoenix metropolitan area. Even as they allow some employees to change how often they come into the office, tech companies are rapidly buying and leasing properties around the country. Big Tech Makes a Big Bet: Offices Are Still the Future ",0.0,0.145
102,2022-02-16 20:00:10+00:00,"Amazon, Apple, Google and Microsoft are expanding their reach over the rest of the economy.","The stock market has lately soured on the technology industry. Stock prices of many of the largest companies are down this year, some slightly — shares of Apple and Google have fallen more than 6 percent — and some stupendously: Facebook's parent company, Meta, and Netflix have lost about a third of their value since the New Year. Because surging tech stocks drove a big part of the stock market’s rise in 2021, their decline has contributed much to the market’s fall. The S & P 500 is down by about 7 percent in 2022.","Amazon, Apple, Google and Microsoft are expanding their reach over the rest of the economy.",The Rise of Big Tech May Just Be Starting,"Amazon, Apple, Google and Microsoft are expanding their reach over the rest of the economy. The stock market has lately soured on the technology industry. Stock prices of many of the largest companies are down this year, some slightly — shares of Apple and Google have fallen more than 6 percent — and some stupendously: Facebook's parent company, Meta, and Netflix have lost about a third of their value since the New Year. Because surging tech stocks drove a big part of the stock market’s rise in 2021, their decline has contributed much to the market’s fall. The S & P 500 is down by about 7 percent in 2022. Amazon, Apple, Google and Microsoft are expanding their reach over the rest of the economy. The Rise of Big Tech May Just Be Starting ",0.046548821548821555,0.23324915824915826
103,2022-02-01 21:16:06+00:00,The earnings by the parent company of Google were above analysts’ estimates.,"These days, there is so much uncertainty surrounding Google’s parent company, Alphabet: a global pandemic, fears of inflation gripping the U.S. economy, restive employees challenging management, and regulators and politicians seemingly bent on taking their pound of flesh.",The earnings by the parent company of Google were above analysts’ estimates.,"Alphabet’s profit increased 36 percent, to $20.64 billion, in the fourth quarter.","The earnings by the parent company of Google were above analysts’ estimates. These days, there is so much uncertainty surrounding Google’s parent company, Alphabet: a global pandemic, fears of inflation gripping the U.S. economy, restive employees challenging management, and regulators and politicians seemingly bent on taking their pound of flesh. The earnings by the parent company of Google were above analysts’ estimates. Alphabet’s profit increased 36 percent, to $20.64 billion, in the fourth quarter. ",0.17142857142857143,0.34285714285714286
