,pub_date,abstract,lead_paragraph,snippet,headline.main,text,polarity,subjectivity
0,2022-10-25 20:37:03+00:00,"Google’s parent company reported earnings that were below analysts’ expectations, bringing in $13.9 billion in profit on $69.1 billion in sales.","Even Alphabet, the parent company of Google and one of the internet’s most entrenched businesses, was not immune to the punishing blows of the global economy and a sharp slowdown in the online advertising that is essential to the company’s profits.","Google’s parent company reported earnings that were below analysts’ expectations, bringing in $13.9 billion in profit on $69.1 billion in sales.",Alphabet’s Profit Drops 27 Percent From a Year Earlier,"Google’s parent company reported earnings that were below analysts’ expectations, bringing in $13.9 billion in profit on $69.1 billion in sales. Even Alphabet, the parent company of Google and one of the internet’s most entrenched businesses, was not immune to the punishing blows of the global economy and a sharp slowdown in the online advertising that is essential to the company’s profits. Google’s parent company reported earnings that were below analysts’ expectations, bringing in $13.9 billion in profit on $69.1 billion in sales. Alphabet’s Profit Drops 27 Percent From a Year Earlier ",0.075,0.41
1,2022-10-26 22:47:44+00:00,A series of quarterly earnings reports is showing that even Silicon Valley’s most powerful companies are feeling the impact of inflation and rising interest rates.,"Google this week reported a steep decline in profits. Social media companies such as Meta said that advertising sales — the heart of their businesses — have rapidly cooled off. And Microsoft, perhaps the tech industry’s most reliable performer, predicted a slowdown through at least the end of the year.",A series of quarterly earnings reports is showing that even Silicon Valley’s most powerful companies are feeling the impact of inflation and rising interest rates.,Tech’s Biggest Companies Are Sending Worrying Signals About the Economy,"A series of quarterly earnings reports is showing that even Silicon Valley’s most powerful companies are feeling the impact of inflation and rising interest rates. Google this week reported a steep decline in profits. Social media companies such as Meta said that advertising sales — the heart of their businesses — have rapidly cooled off. And Microsoft, perhaps the tech industry’s most reliable performer, predicted a slowdown through at least the end of the year. A series of quarterly earnings reports is showing that even Silicon Valley’s most powerful companies are feeling the impact of inflation and rising interest rates. Tech’s Biggest Companies Are Sending Worrying Signals About the Economy ",0.22916666666666669,0.5583333333333333
2,2022-10-20 15:05:58+00:00,"Ken Paxton, the state attorney general, said products like Google Photos and the Nest camera had violated Texans’ privacy rights.","The Texas attorney general filed a privacy lawsuit against Google on Thursday, accusing the internet company of collecting Texans’ facial and voice recognition information without their explicit consent.","Ken Paxton, the state attorney general, said products like Google Photos and the Nest camera had violated Texans’ privacy rights.",Texas Sues Google for Collecting Biometric Data Without Consent,"Ken Paxton, the state attorney general, said products like Google Photos and the Nest camera had violated Texans’ privacy rights. The Texas attorney general filed a privacy lawsuit against Google on Thursday, accusing the internet company of collecting Texans’ facial and voice recognition information without their explicit consent. Ken Paxton, the state attorney general, said products like Google Photos and the Nest camera had violated Texans’ privacy rights. Texas Sues Google for Collecting Biometric Data Without Consent ",0.03750000000000001,0.375
3,2022-10-28 12:06:38+00:00,"The social network’s new owner has just a few days to determine whether to pay millions to employees, or get rid of them.",Elon Musk closes his purchase of Twitter and fires several top executives. Follow for the latest news updates.,"The social network’s new owner has just a few days to determine whether to pay millions to employees, or get rid of them.",Elon Musk Faces Another Big Decision at Twitter,"The social network’s new owner has just a few days to determine whether to pay millions to employees, or get rid of them. Elon Musk closes his purchase of Twitter and fires several top executives. Follow for the latest news updates. The social network’s new owner has just a few days to determine whether to pay millions to employees, or get rid of them. Elon Musk Faces Another Big Decision at Twitter ",0.09393939393939396,0.2742424242424243
4,2022-10-25 18:24:56+00:00,Apple has rejected Spotify’s new app three times from its App Store. It is the latest in a series of confrontations between the two companies.,"Daniel Ek, the chief executive of Spotify, wants his company to be the premier outlet in the world of audio. But when he pushed the streaming-subscription service beyond music and podcasts into audiobooks, he ran into a familiar obstacle: Apple.",Apple has rejected Spotify’s new app three times from its App Store. It is the latest in a series of confrontations between the two companies.,Spotify Wants to Get Into Audiobooks but Says Apple Is in the Way,"Apple has rejected Spotify’s new app three times from its App Store. It is the latest in a series of confrontations between the two companies. Daniel Ek, the chief executive of Spotify, wants his company to be the premier outlet in the world of audio. But when he pushed the streaming-subscription service beyond music and podcasts into audiobooks, he ran into a familiar obstacle: Apple. Apple has rejected Spotify’s new app three times from its App Store. It is the latest in a series of confrontations between the two companies. Spotify Wants to Get Into Audiobooks but Says Apple Is in the Way ",0.29253246753246753,0.487012987012987
5,2022-10-13 19:26:02+00:00,Shares of the SPAC trying to merge with Donald Trump’s social media company rose on Thursday after the decision.,The shares of the cash-rich special purpose acquisition company that seeks to merge with former President Donald J. Trump’s social media company surged on Thursday after Google said it would allow Trump Media & Technology Group’s flagship product to appear in its app store.,Shares of the SPAC trying to merge with Donald Trump’s social media company rose on Thursday after the decision.,Google’s Move to Include Truth Social in App Store Buoys Investor Confidence,Shares of the SPAC trying to merge with Donald Trump’s social media company rose on Thursday after the decision. The shares of the cash-rich special purpose acquisition company that seeks to merge with former President Donald J. Trump’s social media company surged on Thursday after Google said it would allow Trump Media & Technology Group’s flagship product to appear in its app store. Shares of the SPAC trying to merge with Donald Trump’s social media company rose on Thursday after the decision. Google’s Move to Include Truth Social in App Store Buoys Investor Confidence ,0.21130952380952386,0.34226190476190477
6,2022-10-12 17:00:18+00:00,"Developed with Fitbit, Google’s first smart watch takes a page from Apple’s playbook by requiring loyalty to its brand.","It’s 2022, and Google finally has a response to the Apple Watch. It’s the Pixel Watch, which is essentially a Fitbit designed to work only with Android phones and seemingly a direct counterattack to Apple’s wearable that works only with iPhones.","Developed with Fitbit, Google’s first smart watch takes a page from Apple’s playbook by requiring loyalty to its brand.",The Google Watch Is Here. But You’d Better Love Android.,"Developed with Fitbit, Google’s first smart watch takes a page from Apple’s playbook by requiring loyalty to its brand. It’s 2022, and Google finally has a response to the Apple Watch. It’s the Pixel Watch, which is essentially a Fitbit designed to work only with Android phones and seemingly a direct counterattack to Apple’s wearable that works only with iPhones. Developed with Fitbit, Google’s first smart watch takes a page from Apple’s playbook by requiring loyalty to its brand. The Google Watch Is Here. But You’d Better Love Android. ",0.17142857142857143,0.5655677655677656
7,2022-09-29 18:01:39+00:00,"After nearly three years, Google has decided to winnow its video game ambitions because Stadia was less popular than it had anticipated.","Google said it would shutter the video game streaming service Stadia, its answer to Microsoft’s Xbox and Sony’s PlayStation video game consoles, in another sign of Google’s drive to be leaner amid fears of an economic slowdown.","After nearly three years, Google has decided to winnow its video game ambitions because Stadia was less popular than it had anticipated.",Google to Shut Down Stadia Video Game Streaming Service,"After nearly three years, Google has decided to winnow its video game ambitions because Stadia was less popular than it had anticipated. Google said it would shutter the video game streaming service Stadia, its answer to Microsoft’s Xbox and Sony’s PlayStation video game consoles, in another sign of Google’s drive to be leaner amid fears of an economic slowdown. After nearly three years, Google has decided to winnow its video game ambitions because Stadia was less popular than it had anticipated. Google to Shut Down Stadia Video Game Streaming Service ",-0.06837606837606838,0.4017094017094017
8,2022-09-28 17:25:57+00:00,"From more photo-based results to neighborhood “vibe” checks, the company announced updates meant to keep two of its most popular products on trend.","Google’s search engine looks a little different these days. Results pages are now often filled with shopping items, maps, news articles, information bulletins and ads before people can scroll to lists of results — the blue links that became synonymous with the service.","From more photo-based results to neighborhood “vibe” checks, the company announced updates meant to keep two of its most popular products on trend.",Google to Make Search and Maps More ‘Immersive’,"From more photo-based results to neighborhood “vibe” checks, the company announced updates meant to keep two of its most popular products on trend. Google’s search engine looks a little different these days. Results pages are now often filled with shopping items, maps, news articles, information bulletins and ads before people can scroll to lists of results — the blue links that became synonymous with the service. From more photo-based results to neighborhood “vibe” checks, the company announced updates meant to keep two of its most popular products on trend. Google to Make Search and Maps More ‘Immersive’ ",0.3556818181818182,0.5818181818181819
9,2022-09-29 09:00:28+00:00,"Online, Iranians engage in a world their leaders don’t want them to see.","In the physical world, Iran’s authoritarian leaders answer to no one. They try, but often fail, to keep Iranians away from Western entertainment and news. Thanks to their rules, women are required to shroud their hair with head scarves, their bodies with loose clothing.","Online, Iranians engage in a world their leaders don’t want them to see.","Despite Iran’s Efforts to Block Internet, Technology Has Helped Fuel Outrage","Online, Iranians engage in a world their leaders don’t want them to see. In the physical world, Iran’s authoritarian leaders answer to no one. They try, but often fail, to keep Iranians away from Western entertainment and news. Thanks to their rules, women are required to shroud their hair with head scarves, their bodies with loose clothing. Online, Iranians engage in a world their leaders don’t want them to see. Despite Iran’s Efforts to Block Internet, Technology Has Helped Fuel Outrage ",-0.07538461538461538,0.18241758241758238
10,2022-09-22 11:40:56+00:00,"The Federal Reserve has more jumbo-size interest rises planned, stoking fears of downturns in the housing, labor and stock markets.","For a third straight meeting, the Fed raised its benchmark interest rate by 75 basis points — and it’s hardly done. Count on an additional 1.25 percentage points’ worth of increases this year, the Fed chair Jay Powell said yesterday, which would bring the Fed funds rate to 4.4 percent by the end of 2022, and 4.6 percent next year.","The Federal Reserve has more jumbo-size interest rises planned, stoking fears of downturns in the housing, labor and stock markets.","After a Big Rate Increase, Markets Fear a Recession","The Federal Reserve has more jumbo-size interest rises planned, stoking fears of downturns in the housing, labor and stock markets. For a third straight meeting, the Fed raised its benchmark interest rate by 75 basis points — and it’s hardly done. Count on an additional 1.25 percentage points’ worth of increases this year, the Fed chair Jay Powell said yesterday, which would bring the Fed funds rate to 4.4 percent by the end of 2022, and 4.6 percent next year. The Federal Reserve has more jumbo-size interest rises planned, stoking fears of downturns in the housing, labor and stock markets. After a Big Rate Increase, Markets Fear a Recession ",0.15104166666666666,0.2677083333333334
11,2022-09-20 08:00:06+00:00,New research from Mozilla shows YouTube users have little control over what is recommended to them.,"For YouTube viewers dissatisfied with the videos the platform has recommended to them, pressing the “dislike” button may not make a big difference, according to a new research report.",New research from Mozilla shows YouTube users have little control over what is recommended to them.,"YouTube’s Dislike Button Rarely Shifts Recommendations, Researchers Say","New research from Mozilla shows YouTube users have little control over what is recommended to them. For YouTube viewers dissatisfied with the videos the platform has recommended to them, pressing the “dislike” button may not make a big difference, according to a new research report. New research from Mozilla shows YouTube users have little control over what is recommended to them. YouTube’s Dislike Button Rarely Shifts Recommendations, Researchers Say ",0.04772727272727272,0.4805194805194805
12,2022-09-16 09:00:25+00:00,Need to find a restaurant or figure out how to do something? Young people are turning to TikTok to search for answers. Google has noticed.,"When Ja’Kobi Moore decided to apply this year to a private high school in her hometown of New Orleans, she learned that she needed at least one letter of recommendation from a teacher. She had never asked for one, so she sought help.",Need to find a restaurant or figure out how to do something? Young people are turning to TikTok to search for answers. Google has noticed.,"For Gen Z, TikTok Is the New Search Engine","Need to find a restaurant or figure out how to do something? Young people are turning to TikTok to search for answers. Google has noticed. When Ja’Kobi Moore decided to apply this year to a private high school in her hometown of New Orleans, she learned that she needed at least one letter of recommendation from a teacher. She had never asked for one, so she sought help. Need to find a restaurant or figure out how to do something? Young people are turning to TikTok to search for answers. Google has noticed. For Gen Z, TikTok Is the New Search Engine ",0.04753246753246754,0.432012987012987
13,2022-09-16 03:19:55+00:00,"The video platform will let more creators earn payments and place ads in Shorts, its TikTok competitor, according to audio from an internal meeting.","YouTube is expected to announce more opportunities for content creators to earn money on its video service, hoping to guard its role as a home to popular personalities and gain an edge against rival TikTok.","The video platform will let more creators earn payments and place ads in Shorts, its TikTok competitor, according to audio from an internal meeting.",YouTube Opens More Pathways for Creators to Make Money on the Platform,"The video platform will let more creators earn payments and place ads in Shorts, its TikTok competitor, according to audio from an internal meeting. YouTube is expected to announce more opportunities for content creators to earn money on its video service, hoping to guard its role as a home to popular personalities and gain an edge against rival TikTok. The video platform will let more creators earn payments and place ads in Shorts, its TikTok competitor, according to audio from an internal meeting. YouTube Opens More Pathways for Creators to Make Money on the Platform ",0.3125,0.4125
14,2022-09-14 10:32:21+00:00,A court rejected Google’s appeal of a record-setting antitrust fine related to Android and online search.,LONDON — Global efforts to crimp the power of the world’s largest technology companies scored an important legal victory on Wednesday when a European Union court gave its blessing to a record multibillion-dollar fine issued against Google in 2018.,A court rejected Google’s appeal of a record-setting antitrust fine related to Android and online search.,E.U. Scores Major Legal Victory Against Google,A court rejected Google’s appeal of a record-setting antitrust fine related to Android and online search. LONDON — Global efforts to crimp the power of the world’s largest technology companies scored an important legal victory on Wednesday when a European Union court gave its blessing to a record multibillion-dollar fine issued against Google in 2018. A court rejected Google’s appeal of a record-setting antitrust fine related to Android and online search. E.U. Scores Major Legal Victory Against Google ,0.19204545454545457,0.38181818181818183
15,2022-09-15 09:00:26+00:00,"Data mining plus streaming can target political ads household by household, largely unregulated.","Over the last few weeks, tens of thousands of voters in the Detroit area who watch streaming video services were shown different local campaign ads pegged to their political leanings.","Data mining plus streaming can target political ads household by household, largely unregulated.",This Ad’s for You (Not Your Neighbor),"Data mining plus streaming can target political ads household by household, largely unregulated. Over the last few weeks, tens of thousands of voters in the Detroit area who watch streaming video services were shown different local campaign ads pegged to their political leanings. Data mining plus streaming can target political ads household by household, largely unregulated. This Ad’s for You (Not Your Neighbor) ",0.025396825396825393,0.21375661375661376
16,2022-09-14 09:00:25+00:00,"Apple and Google have added useful features to texting apps, yet the apps still lack a major component: an effective way to set limits.","The text-messaging app has always been the most-used app on my phone. It’s fun and efficient, and it’s often a quicker way to get a response than sending an email or making a phone call.","Apple and Google have added useful features to texting apps, yet the apps still lack a major component: an effective way to set limits.",Text Messaging Is Cool. But Where Are Its Boundaries?,"Apple and Google have added useful features to texting apps, yet the apps still lack a major component: an effective way to set limits. The text-messaging app has always been the most-used app on my phone. It’s fun and efficient, and it’s often a quicker way to get a response than sending an email or making a phone call. Apple and Google have added useful features to texting apps, yet the apps still lack a major component: an effective way to set limits. Text Messaging Is Cool. But Where Are Its Boundaries? ",0.321875,0.43124999999999997
17,2022-09-02 19:23:55+00:00,Google said that Parler had more robust content moderation practices than it did when it was banned in the aftermath of the Jan. 6 riot.,"Parler, the social media service that attracted fans of former President Donald J. Trump, will return to Google’s Play app store on Friday, more than a year after Google suspended the app for content that incited violence.",Google said that Parler had more robust content moderation practices than it did when it was banned in the aftermath of the Jan. 6 riot.,Parler Returns to Google Play Store,"Google said that Parler had more robust content moderation practices than it did when it was banned in the aftermath of the Jan. 6 riot. Parler, the social media service that attracted fans of former President Donald J. Trump, will return to Google’s Play app store on Friday, more than a year after Google suspended the app for content that incited violence. Google said that Parler had more robust content moderation practices than it did when it was banned in the aftermath of the Jan. 6 riot. Parler Returns to Google Play Store ",0.30666666666666664,0.31333333333333335
18,2022-09-01 09:01:10+00:00,"Worried about geopolitical tensions and stung by pandemic shutdowns, Google, Apple and others are moving some work to nearby countries.","In the coming weeks, Apple and Google will unveil their latest generation of smartphones, jockeying to distinguish the new devices from previous models. But one of the most significant changes will go largely unnoticed by consumers: Some of these phones will not be made in China.","Worried about geopolitical tensions and stung by pandemic shutdowns, Google, Apple and others are moving some work to nearby countries.",Tech Companies Slowly Shift Production Away From China,"Worried about geopolitical tensions and stung by pandemic shutdowns, Google, Apple and others are moving some work to nearby countries. In the coming weeks, Apple and Google will unveil their latest generation of smartphones, jockeying to distinguish the new devices from previous models. But one of the most significant changes will go largely unnoticed by consumers: Some of these phones will not be made in China. Worried about geopolitical tensions and stung by pandemic shutdowns, Google, Apple and others are moving some work to nearby countries. Tech Companies Slowly Shift Production Away From China ",0.12067099567099568,0.5566017316017317
19,2022-09-01 11:54:05+00:00,"Apple, Google and Microsoft are among the technology firms looking to shift some of their manufacturing out of China.","This month, Apple is expected to release the iPhone 14. Beyond rumors, little is known about what the crew from Cupertino, Calif., has planned for the company’s newest version of its nearly ubiquitous smartphone.","Apple, Google and Microsoft are among the technology firms looking to shift some of their manufacturing out of China.",Big Tech Reconsiders the “Made in China” Way,"Apple, Google and Microsoft are among the technology firms looking to shift some of their manufacturing out of China. This month, Apple is expected to release the iPhone 14. Beyond rumors, little is known about what the crew from Cupertino, Calif., has planned for the company’s newest version of its nearly ubiquitous smartphone. Apple, Google and Microsoft are among the technology firms looking to shift some of their manufacturing out of China. Big Tech Reconsiders the “Made in China” Way ",-0.04687499999999999,0.35000000000000003
20,2022-08-30 20:57:56+00:00,"The social media app is not available on Google’s app store, and the former president’s company and Google are publicly disagreeing about why.","Google said on Tuesday that it would not distribute Truth Social on its Play app store until Truth Social, the social media platform founded by former President Donald J. Trump, removed content that incites violence.","The social media app is not available on Google’s app store, and the former president’s company and Google are publicly disagreeing about why.",Google Says Trump’s Truth Social Must Scrub Violent Content to Join Play Store,"The social media app is not available on Google’s app store, and the former president’s company and Google are publicly disagreeing about why. Google said on Tuesday that it would not distribute Truth Social on its Play app store until Truth Social, the social media platform founded by former President Donald J. Trump, removed content that incites violence. The social media app is not available on Google’s app store, and the former president’s company and Google are publicly disagreeing about why. Google Says Trump’s Truth Social Must Scrub Violent Content to Join Play Store ",-0.07142857142857142,0.16666666666666666
